0,1,2,3,4,5,6,7,8,9,10,11,12,13,14,15,16
CODIGO,DISTRITO,DEPARTAMENTO,MUNICIPIO,ESTABLECIMIENTO,DIRECCION,TELEFONO,SUPERVISOR,DIRECTOR,NIVEL,SECTOR,AREA,STATUS,MODALIDAD,JORNADA,PLAN,DEPARTAMENTAL
16-01-0061-43,16-001,ALTA VERAPAZ,COBAN,EOUN NO.1 'FELIPA GOMEZ',2A. CALLE 1-99 ZONA 4,41362111,EFRAIN CAAL CUC,HAROLDO BENJAMÍN HERRERA,PRIMARIA,OFICIAL,URBANA,ABIERTA,MONOLINGUE,MATUTINA,DIARIO(REGULAR),ALTA VERAPAZ
16-01-0062-43,16-001,ALTA VERAPAZ,COBAN,EOUV NO.2 'SALVADOR DE OLIVA',5A. CALLE 2-80 ZONA 3,79510749,EFRAIN CAAL CUC,SODELVA ESCARLETH BUENAFÉ PÉREZ,PRIMARIA,OFICIAL,URBANA,ABIERTA,MONOLINGUE,MATUTINA,DIARIO(REGULAR),ALTA VERAPAZ
16-01-0063-43,16-001,ALTA VERAPAZ,COBAN,EOUV NO. 1 'VICTOR CHAVARRIA',10A. AVENIDA 4-22 ZONA 2,79510789,EFRAIN CAAL CUC,NELSON RENE LOPEZ CAAL,PRIMARIA,OFICIAL,URBANA,ABIERTA,MONOLINGUE,MATUTINA,DIARIO(REGULAR),ALTA VERAPAZ
16-01-0064-43,16-001,ALTA VERAPAZ,COBAN,"EOUM DE APLICACION ""GENERAL ARTURO GUILLERMO DE LA CRUZ GELPCKE""",6A. AVENIDA 6-66 ZONA 11 BARRIO LA LIBERTAD,53352341,EFRAIN CAAL CUC,FREDY GUILLERMO CUC MO,PRIMARIA,OFICIAL,URBANA,ABIERTA,MONOLINGUE,MATUTINA,DIARIO(REGULAR),ALTA VERAPAZ
16-01-0065-43,16-001,ALTA VERAPAZ,COBAN,EOUM,CANTON LAS CASAS,77945323,EFRAIN CAAL CUC,JUAN JOSÉ JOLOMNÁ,PRIMARIA,OFICIAL,URBANA,ABIERTA,MONOLINGUE,MATUTINA,DIARIO(REGULAR),ALTA VERAPAZ
16-01-0066-43,16-001,ALTA VERAPAZ,COBAN,EOUM 'RICARDO ANDERSON',9A. AVENIDA 7-28 ZONA 10,77250185,EFRAIN CAAL CUC,DANIEL BERNARDO RAMIREZ GONZÁLEZ,PRIMARIA,OFICIAL,URBANA,ABIERTA,MONOLINGUE,MATUTINA,DIARIO(REGULAR),ALTA VERAPAZ
16-01-0067-43,16-004,ALTA VERAPAZ,COBAN,EORM,ALDEA SAN JOSE ICBOLAY,,AQUILES GIOVANI BAC GUEVARA,EDGAR BENJAMIN CAAL SAQUI,PRIMARIA,OFICIAL,RURAL,ABIERTA,BILINGUE,MATUTINA,DIARIO(REGULAR),ALTA VERAPAZ
16-01-0068-43,16-037,ALTA VERAPAZ,COBAN,EORM,ALDEA SALACUIM,57852818,CESAR RIGOBERTO CUC CAAL,ANA MARIA CHOC COC,PRIMARIA,OFICIAL,RURAL,ABIERTA,BILINGUE,MATUTINA,DIARIO(REGULAR),ALTA VERAPAZ
16-01-0069-43,16-004,ALTA VERAPAZ,COBAN,EORM,ALDEA SAN BENITO I,31996977,AQUILES GIOVANI BAC GUEVARA,ALMAGRO RIGOBERTO FRANCO FERNÁNDEZ,PRIMARIA,OFICIAL,RURAL,ABIERTA,BILINGUE,MATUTINA,DIARIO(REGULAR),ALTA VERAPAZ
16-01-0071-43,16-004,ALTA VERAPAZ,COBAN,EORM,ALDEA SAHOLOM,45398450,AQUILES GIOVANI BAC GUEVARA,RUDY ELEODORO MAX XOL,PRIMARIA,OFICIAL,RURAL,ABIERTA,BILINGUE,MATUTINA,DIARIO(REGULAR),ALTA VERAPAZ
16-01-0072-43,16-002,ALTA VERAPAZ,COBAN,EORM,ALDEA SAN PABLO XUCANEB,45187639,MOISES ADRIAN LOPEZ PEREZ,MARGARITA FLORICELDA HIDALGO CHO,PRIMARIA,OFICIAL,RURAL,ABIERTA,BILINGUE,MATUTINA,DIARIO(REGULAR),ALTA VERAPAZ
16-01-0075-43,16-004,ALTA VERAPAZ,COBAN,EORM,ALDEA SANTA LUCIA LACHUA,57240914,AQUILES GIOVANI BAC GUEVARA,DIONICIO CHOC CÚ,PRIMARIA,OFICIAL,RURAL,ABIERTA,BILINGUE,MATUTINA,DIARIO(REGULAR),ALTA VERAPAZ
16-01-0077-43,16-002,ALTA VERAPAZ,COBAN,EORM,ALDEA CHICOJ RAXQUIX,,MOISES ADRIAN LOPEZ PEREZ,SERGIO ARMANDO MAAZ BOL,PRIMARIA,OFICIAL,RURAL,ABIERTA,BILINGUE,MATUTINA,DIARIO(REGULAR),ALTA VERAPAZ
16-01-0078-43,16-034,ALTA VERAPAZ,COBAN,EORM,ALDEA TONTZUL UCULA,49118819,FELIPE CHO TUT,GLORIA CHUB,PRIMARIA,OFICIAL,RURAL,ABIERTA,BILINGUE,MATUTINA,DIARIO(REGULAR),ALTA VERAPAZ
16-01-0079-43,16-047,ALTA VERAPAZ,COBAN,EORM,ALDEA CHOVAL,42118885,ERNESTO CAAL CHOC,EDGARDO EFRAIN PEREIRA RODRIGUEZ,PRIMARIA,OFICIAL,RURAL,ABIERTA,BILINGUE,MATUTINA,DIARIO(REGULAR),ALTA VERAPAZ
16-01-0081-43,16-003,ALTA VERAPAZ,COBAN,EORM,ALDEA CONCEPCION AQUIL,53667821,JOSE ARTURO CHOC CHEN,EVELYN AMELIA MORALES GARCIA,PRIMARIA,OFICIAL,RURAL,ABIERTA,BILINGUE,MATUTINA,DIARIO(REGULAR),ALTA VERAPAZ
16-01-0082-43,16-001,ALTA VERAPAZ,COBAN,EORM,ALDEA PETET,52691118,EFRAIN CAAL CUC,RODERICO MAXENA SIERRA,PRIMARIA,OFICIAL,RURAL,ABIERTA,MONOLINGUE,MATUTINA,DIARIO(REGULAR),ALTA VERAPAZ
16-01-0083-43,16-035,ALTA VERAPAZ,COBAN,EORM,ALDEA CACAHUILA,,MARBIN ARIEL CHOC CAAL,ARTURO QUIB CAAL,PRIMARIA,OFICIAL,RURAL,ABIERTA,BILINGUE,MATUTINA,DIARIO(REGULAR),ALTA VERAPAZ
16-01-0084-43,16-003,ALTA VERAPAZ,COBAN,EORM,ALDEA OSTUA,35803530,JOSE ARTURO CHOC CHEN,WAGNER KRESTER POP GUTIERREZ,PRIMARIA,OFICIAL,RURAL,ABIERTA,BILINGUE,MATUTINA,DIARIO(REGULAR),ALTA VERAPAZ
16-01-0085-43,16-002,ALTA VERAPAZ,COBAN,EORM,ALDEA SATEX,50541785,MOISES ADRIAN LOPEZ PEREZ,MICAELA AMÉRICA SAPÓN TAHUAL,PRIMARIA,OFICIAL,RURAL,ABIERTA,BILINGUE,MATUTINA,DIARIO(REGULAR),ALTA VERAPAZ
16-01-0086-43,16-002,ALTA VERAPAZ,COBAN,EORM 'DR. TOMAS LEAL SANCHEZ',ALDEA TONTEM,55414517,MOISES ADRIAN LOPEZ PEREZ,EDIN BALDOMERO CHEN CABNAL,PRIMARIA,OFICIAL,RURAL,ABIERTA,BILINGUE,MATUTINA,DIARIO(REGULAR),ALTA VERAPAZ
16-01-0088-43,16-001,ALTA VERAPAZ,COBAN,EORM,COOPERATIVA CHICOJ,50475284,EFRAIN CAAL CUC,MARIO AGUILAR XOL,PRIMARIA,OFICIAL,RURAL,ABIERTA,BILINGUE,MATUTINA,DIARIO(REGULAR),ALTA VERAPAZ
16-01-0089-43,16-001,ALTA VERAPAZ,COBAN,EORM,ALDEA CHICHAIC,59489259,EFRAIN CAAL CUC,AIDA IVONNE SIERRA QUIROA,PRIMARIA,OFICIAL,RURAL,ABIERTA,BILINGUE,MATUTINA,DIARIO(REGULAR),ALTA VERAPAZ
16-01-0090-43,16-002,ALTA VERAPAZ,COBAN,EORM,ALDEA CHITZUJAY,45155857,MOISES ADRIAN LOPEZ PEREZ,INGRID LEOCADIA CAAL GARCIA,PRIMARIA,OFICIAL,RURAL,ABIERTA,BILINGUE,MATUTINA,DIARIO(REGULAR),ALTA VERAPAZ
16-01-0091-43,16-034,ALTA VERAPAZ,COBAN,EORM,ALDEA SAN PEDRO CANAHU,30281629,FELIPE CHO TUT,SAMUEL ARRIAGA DIEGO CRISTOBAL,PRIMARIA,OFICIAL,RURAL,ABIERTA,BILINGUE,MATUTINA,DIARIO(REGULAR),ALTA VERAPAZ
16-01-0092-43,16-047,ALTA VERAPAZ,COBAN,EORM,ALDEA UCULA,30751787,ERNESTO CAAL CHOC,ANTONIO ALFREDO AGUILAR HERNÁNDEZ,PRIMARIA,OFICIAL,RURAL,ABIERTA,BILINGUE,MATUTINA,DIARIO(REGULAR),ALTA VERAPAZ
16-01-0093-43,16-047,ALTA VERAPAZ,COBAN,EORM,FINCA BILTITUN,52007750,ERNESTO CAAL CHOC,MYNOR GUSTAVO IPIÑA ESPAÑA,PRIMARIA,OFICIAL,RURAL,ABIERTA,BILINGUE,MATUTINA,DIARIO(REGULAR),ALTA VERAPAZ
16-01-0096-43,16-047,ALTA VERAPAZ,COBAN,EORM,ALDEA CHILATZ,,ERNESTO CAAL CHOC,ROLANDO CHUN YAT,PRIMARIA,OFICIAL,RURAL,ABIERTA,BILINGUE,MATUTINA,DIARIO(REGULAR),ALTA VERAPAZ
16-01-0097-43,16-003,ALTA VERAPAZ,COBAN,EORM,ALDEA BALBATZUL,59414129,JOSE ARTURO CHOC CHEN,ROGELIA FLORENTINA LEAL LACAN,PRIMARIA,OFICIAL,RURAL,ABIERTA,BILINGUE,MATUTINA,DIARIO(REGULAR),ALTA VERAPAZ
16-01-0098-43,16-034,ALTA VERAPAZ,COBAN,EORM,ALDEA SECOCPUR,47925921,FELIPE CHO TUT,JORGE FRANCISCO CUZ CUCUL,PRIMARIA,OFICIAL,RURAL,ABIERTA,BILINGUE,MATUTINA,DIARIO(REGULAR),ALTA VERAPAZ
16-01-0099-43,16-047,ALTA VERAPAZ,COBAN,EORM,ALDEA EL ROSARIO KM. 227 RUTA A CHISEC,40802545,ERNESTO CAAL CHOC,MARCO TULIO CHOC CAAL,PRIMARIA,OFICIAL,RURAL,ABIERTA,BILINGUE,MATUTINA,DIARIO(REGULAR),ALTA VERAPAZ
16-01-0100-43,16-003,ALTA VERAPAZ,COBAN,EORM,ALDEA SONTE,45682217,JOSE ARTURO CHOC CHEN,ZOILA AMANDA PRADO PAZ,PRIMARIA,OFICIAL,RURAL,ABIERTA,BILINGUE,MATUTINA,DIARIO(REGULAR),ALTA VERAPAZ
16-01-0101-43,16-047,ALTA VERAPAZ,COBAN,EORM,ALDEA SAN ISIDRO CHOVAL,32685979,ERNESTO CAAL CHOC,EDGAR CHÉN,PRIMARIA,OFICIAL,RURAL,ABIERTA,BILINGUE,MATUTINA,DIARIO(REGULAR),ALTA VERAPAZ
16-01-0102-43,16-003,ALTA VERAPAZ,COBAN,EORM,ALDEA CHITOCAN I,,JOSE ARTURO CHOC CHEN,BERTHA ALICIA CAAL TENÍ,PRIMARIA,OFICIAL,RURAL,ABIERTA,BILINGUE,MATUTINA,DIARIO(REGULAR),ALTA VERAPAZ
16-01-0103-43,16-003,ALTA VERAPAZ,COBAN,EORM,ALDEA SAXOC,57505824,JOSE ARTURO CHOC CHEN,JULIO CÉSAR CÚ QUIB,PRIMARIA,OFICIAL,RURAL,ABIERTA,BILINGUE,MATUTINA,DIARIO(REGULAR),ALTA VERAPAZ
16-01-0104-43,16-047,ALTA VERAPAZ,COBAN,EORM,ALDEA CHINACOCOM,,ERNESTO CAAL CHOC,GLADIS MICAELA XOY CUC,PRIMARIA,OFICIAL,RURAL,ABIERTA,MONOLINGUE,MATUTINA,DIARIO(REGULAR),ALTA VERAPAZ
16-01-0106-43,16-002,ALTA VERAPAZ,COBAN,EORM,ALDEA SAMAC,,MOISES ADRIAN LOPEZ PEREZ,JESSICA AZUCENA LEAL CATUN,PRIMARIA,OFICIAL,RURAL,ABIERTA,BILINGUE,MATUTINA,DIARIO(REGULAR),ALTA VERAPAZ
16-01-0107-43,16-001,ALTA VERAPAZ,COBAN,"EORM ""PROFESORA ROSAURA BELLAMAR IBAÑEZ WINTER DE SIERRA""","1A. AVENIDA A 11-40 ZONA 12, FINCA SACHAMACH",31412495,EFRAIN CAAL CUC,CARLOS CAAL CUCUL,PRIMARIA,OFICIAL,RURAL,ABIERTA,BILINGUE,MATUTINA,DIARIO(REGULAR),ALTA VERAPAZ
16-01-0108-43,16-001,ALTA VERAPAZ,COBAN,EORM 'SARBELIO MORAN CHINCHILLA',LOTIFICACION CHIVENCORRAL,57309865,EFRAIN CAAL CUC,ROMEO ANÍBAL QUIROA CUZ,PRIMARIA,OFICIAL,URBANA,ABIERTA,MONOLINGUE,MATUTINA,DIARIO(REGULAR),ALTA VERAPAZ
16-01-0109-43,16-003,ALTA VERAPAZ,COBAN,EORM,FINCA SACHICHA,,JOSE ARTURO CHOC CHEN,HUGO FERNANDO GARCÍA LÓPEZ,PRIMARIA,OFICIAL,RURAL,ABIERTA,BILINGUE,MATUTINA,DIARIO(REGULAR),ALTA VERAPAZ
16-01-0110-43,16-001,ALTA VERAPAZ,COBAN,EOUM,BARRIO LA LIBERTAD ZONA 11,79514322,EFRAIN CAAL CUC,ASTRID LINELLY ALVARADO HERNÁNDEZ,PRIMARIA,OFICIAL,URBANA,ABIERTA,MONOLINGUE,MATUTINA,DIARIO(REGULAR),ALTA VERAPAZ
16-01-0111-43,16-001,ALTA VERAPAZ,COBAN,EORM,ALDEA SIGUANHA,51510388,EFRAIN CAAL CUC,ABELINO CUC POP,PRIMARIA,OFICIAL,RURAL,ABIERTA,BILINGUE,MATUTINA,DIARIO(REGULAR),ALTA VERAPAZ
16-01-0112-43,16-001,ALTA VERAPAZ,COBAN,EORM,ALDEA GUALOM,40227858,EFRAIN CAAL CUC,BRENDA ELIZABETH GARCÍA LEAL,PRIMARIA,OFICIAL,RURAL,ABIERTA,BILINGUE,MATUTINA,DIARIO(REGULAR),ALTA VERAPAZ
16-01-0113-43,16-002,ALTA VERAPAZ,COBAN,EORM,ALDEA SARRAX-OCH,45270723,MOISES ADRIAN LOPEZ PEREZ,GUILLERMINA ARÉVALO CHEN,PRIMARIA,OFICIAL,RURAL,ABIERTA,BILINGUE,MATUTINA,DIARIO(REGULAR),ALTA VERAPAZ
16-01-0114-43,16-002,ALTA VERAPAZ,COBAN,EORM,ALDEA CHIRREPEC,,MOISES ADRIAN LOPEZ PEREZ,JOSÉ TUN CAO,PRIMARIA,OFICIAL,RURAL,ABIERTA,BILINGUE,MATUTINA,DIARIO(REGULAR),ALTA VERAPAZ
16-01-0115-43,16-002,ALTA VERAPAZ,COBAN,EORM 'JOSE FEDERICO PINEDA',ALDEA CHICUXAB,46289573,MOISES ADRIAN LOPEZ PEREZ,JAIME OSWALDO TUT ICÓ,PRIMARIA,OFICIAL,RURAL,ABIERTA,BILINGUE,MATUTINA,DIARIO(REGULAR),ALTA VERAPAZ
16-01-0116-43,16-001,ALTA VERAPAZ,COBAN,EORM 'AIDA MARTINEZ',ALDEA SAN JOSE LA COLONIA,40295070,EFRAIN CAAL CUC,ARELY EUNISE MACZ CAAL,PRIMARIA,OFICIAL,RURAL,ABIERTA,BILINGUE,MATUTINA,DIARIO(REGULAR),ALTA VERAPAZ
16-01-0118-43,16-003,ALTA VERAPAZ,COBAN,EORM,ALDEA CAMCAL,52073592,JOSE ARTURO CHOC CHEN,MARTA ALICIA JUÁREZ,PRIMARIA,OFICIAL,RURAL,ABIERTA,BILINGUE,MATUTINA,DIARIO(REGULAR),ALTA VERAPAZ
16-01-0119-43,16-003,ALTA VERAPAZ,COBAN,EORM,ALDEA CERRO LINDO SACHICHA,53369201,JOSE ARTURO CHOC CHEN,MARLON GEOVANNI BUENAFÉ ORELLANA,PRIMARIA,OFICIAL,RURAL,ABIERTA,BILINGUE,MATUTINA,DIARIO(REGULAR),ALTA VERAPAZ
16-01-0121-43,16-047,ALTA VERAPAZ,COBAN,EORM,ALDEA CHINA ICHAB,30768602,ERNESTO CAAL CHOC,VIRGINIA LETICIA COC TUT,PRIMARIA,OFICIAL,RURAL,ABIERTA,BILINGUE,MATUTINA,DIARIO(REGULAR),ALTA VERAPAZ
16-01-0122-43,16-047,ALTA VERAPAZ,COBAN,EORM,ALDEA CERRITOS SAMOX CHIRRAXCAJ,,ERNESTO CAAL CHOC,GENGLY SURELY ALVARADO GARCIA,PRIMARIA,OFICIAL,RURAL,ABIERTA,BILINGUE,MATUTINA,DIARIO(REGULAR),ALTA VERAPAZ
16-01-0123-43,16-002,ALTA VERAPAZ,COBAN,EORM,ALDEA SACANAIX,40461174,MOISES ADRIAN LOPEZ PEREZ,GLENDA MARITZA CAAL ICAL,PRIMARIA,OFICIAL,RURAL,ABIERTA,BILINGUE,MATUTINA,DIARIO(REGULAR),ALTA VERAPAZ
16-01-0125-43,16-031,ALTA VERAPAZ,COBAN,COLEGIO PARTICULAR MIXTO VERAPAZ,KM 209.5 ENTRADA A LA CIUDAD,77367402,PATRICIO NAJARRO ASENCIO,JORGE EDY GUTIERREZ PONCE,PRIMARIA,PRIVADO,URBANA,ABIERTA,MONOLINGUE,MATUTINA,DIARIO(REGULAR),ALTA VERAPAZ
16-01-0126-43,16-031,ALTA VERAPAZ,COBAN,COLEGIO LA INMACULADA,7A. AVENIDA 11-109 ZONA 6,49532425,PATRICIO NAJARRO ASENCIO,VIRGINIA SOLANO SERRANO,PRIMARIA,PRIVADO,URBANA,ABIERTA,MONOLINGUE,MATUTINA,DIARIO(REGULAR),ALTA VERAPAZ
16-01-0127-43,16-001,ALTA VERAPAZ,COBAN,EOUN NO.2 JOSEFA JACINTO,13 AVENIDA 2-12 ZONA 2,77930829,EFRAIN CAAL CUC,LILIAN ROXANA AMPÉREZ,PRIMARIA,OFICIAL,URBANA,ABIERTA,MONOLINGUE,MATUTINA,DIARIO(REGULAR),ALTA VERAPAZ
16-01-0128-43,16-031,ALTA VERAPAZ,COBAN,COLEGIO MIXTO EVANGELICO NAZARENO,6A. CALLE 8-10 ZONA 10,79511866,PATRICIO NAJARRO ASENCIO,ANA MARIA YAT COY,PRIMARIA,PRIVADO,URBANA,ABIERTA,MONOLINGUE,MATUTINA,DIARIO(REGULAR),ALTA VERAPAZ
16-01-0131-43,16-004,ALTA VERAPAZ,COBAN,EORM,ALDEA RIO TZETOC,,AQUILES GIOVANI BAC GUEVARA,JOSÉ ALEJANDRO YALIBAT FLORES,PRIMARIA,OFICIAL,RURAL,ABIERTA,BILINGUE,MATUTINA,DIARIO(REGULAR),ALTA VERAPAZ
16-01-0132-43,16-002,ALTA VERAPAZ,COBAN,EORM,ALDEA LAS CRUCES,45856839,MOISES ADRIAN LOPEZ PEREZ,GLADYZ ODETTE GUZMAN DIAZ,PRIMARIA,OFICIAL,RURAL,ABIERTA,BILINGUE,MATUTINA,DIARIO(REGULAR),ALTA VERAPAZ
16-01-0219-43,16-004,ALTA VERAPAZ,COBAN,EORM,ALDEA EL TRIUNFO NUEVE CERROS,53452539,AQUILES GIOVANI BAC GUEVARA,DANIELA FERNANDA COY LÓPEZ,PRIMARIA,OFICIAL,RURAL,ABIERTA,BILINGUE,MATUTINA,DIARIO(REGULAR),ALTA VERAPAZ
16-01-0220-43,16-034,ALTA VERAPAZ,COBAN,EORM,CASERIO SAMANZANA,56294218,FELIPE CHO TUT,ROLANDO BOL POP,PRIMARIA,OFICIAL,RURAL,ABIERTA,BILINGUE,MATUTINA,DIARIO(REGULAR),ALTA VERAPAZ
16-01-0221-43,16-003,ALTA VERAPAZ,COBAN,EORM,ALDEA LAS PROMESAS,,JOSE ARTURO CHOC CHEN,ELIZARDO RODRIGO CAAL CAQUINAM,PRIMARIA,OFICIAL,RURAL,ABIERTA,BILINGUE,MATUTINA,DIARIO(REGULAR),ALTA VERAPAZ
16-01-0222-43,16-003,ALTA VERAPAZ,COBAN,EORM,COMUNIDAD CHAJMACAN,30708341,JOSE ARTURO CHOC CHEN,LUDWIN FRANCISCO ITZEP BARRIENTOS,PRIMARIA,OFICIAL,RURAL,ABIERTA,BILINGUE,MATUTINA,DIARIO(REGULAR),ALTA VERAPAZ
16-01-0223-43,16-034,ALTA VERAPAZ,COBAN,EORM COMUNIDAD LAS LAGUNAS DEL FAISÁN,COMUNIDAD LAS LAGUNAS EL FAISAN,58831313,FELIPE CHO TUT,SARA ESTHER TOC QUEJ,PRIMARIA,OFICIAL,RURAL,ABIERTA,BILINGUE,MATUTINA,DIARIO(REGULAR),ALTA VERAPAZ
16-01-0224-43,16-035,ALTA VERAPAZ,COBAN,EORM CASERIO SESAJAB II,CASERIO SESAJAB II,44908582,MARBIN ARIEL CHOC CAAL,JOSÉ DOMINGO XOL BA,PRIMARIA,OFICIAL,RURAL,ABIERTA,BILINGUE,MATUTINA,DIARIO(REGULAR),ALTA VERAPAZ
16-01-0225-43,16-003,ALTA VERAPAZ,COBAN,EORM,COMUNIDAD SACTATE,49536843,JOSE ARTURO CHOC CHEN,DOMINGO ASIG CAÁL,PRIMARIA,OFICIAL,RURAL,ABIERTA,BILINGUE,MATUTINA,DIARIO(REGULAR),ALTA VERAPAZ
16-01-0226-43,16-004,ALTA VERAPAZ,COBAN,EORM ALDEA RIO TZETOC,ALDEA RIO TZETOC,,AQUILES GIOVANI BAC GUEVARA,JUAN ELÍAS CAAL IXIM,PRIMARIA,OFICIAL,RURAL,ABIERTA,BILINGUE,MATUTINA,DIARIO(REGULAR),ALTA VERAPAZ
16-01-0227-43,16-002,ALTA VERAPAZ,COBAN,EORM COMUNIDAD MESTELA,ALDEA MESTELA,57234300,MOISES ADRIAN LOPEZ PEREZ,DELMY VIRGINIA CUC TORRES,PRIMARIA,OFICIAL,RURAL,ABIERTA,BILINGUE,MATUTINA,DIARIO(REGULAR),ALTA VERAPAZ
16-01-0228-43,16-003,ALTA VERAPAZ,COBAN,EORM,CASERIO RIO MOJARRAS CAMPAMAC,32807836,JOSE ARTURO CHOC CHEN,PRISCILLA MARISOL GUZMAN CUCUL,PRIMARIA,OFICIAL,RURAL,ABIERTA,BILINGUE,MATUTINA,DIARIO(REGULAR),ALTA VERAPAZ
16-01-0229-43,16-034,ALTA VERAPAZ,COBAN,EORM CASERIO PATATE ICBOLAY,CASERIO PATATE ICBOLAY,45813222,FELIPE CHO TUT,ALVARO MACARIO COC SAGUÍ,PRIMARIA,OFICIAL,RURAL,ABIERTA,BILINGUE,MATUTINA,DIARIO(REGULAR),ALTA VERAPAZ
16-01-0230-43,16-035,ALTA VERAPAZ,COBAN,EORM COMUNIDAD SAPOX I,COMUNIDAD SAPOX I,45761857,MARBIN ARIEL CHOC CAAL,GERMAN ALFREDO CHUB YAXCAL,PRIMARIA,OFICIAL,RURAL,ABIERTA,BILINGUE,MATUTINA,DIARIO(REGULAR),ALTA VERAPAZ
16-01-0231-43,16-001,ALTA VERAPAZ,COBAN,EORM COMUNIDAD PETET CHIXIC,ALDEA PETET CHIXIC,79512482,EFRAIN CAAL CUC,OSCAR ROMEO TZÍ CHUB,PRIMARIA,OFICIAL,RURAL,ABIERTA,BILINGUE,MATUTINA,DIARIO(REGULAR),ALTA VERAPAZ
16-01-0232-43,16-003,ALTA VERAPAZ,COBAN,EORM ALDEA NUEVO AQUIL,ALDEA NUEVO AQUIL,55217614,JOSE ARTURO CHOC CHEN,AFNER OSBELY LEAL GARCÍA,PRIMARIA,OFICIAL,RURAL,ABIERTA,BILINGUE,MATUTINA,DIARIO(REGULAR),ALTA VERAPAZ
16-01-0233-43,16-037,ALTA VERAPAZ,COBAN,EORM,COMUNIDAD SAN LORENZO II,33998506,CESAR RIGOBERTO CUC CAAL,SANDRA NOEMI QUIB SACRAB,PRIMARIA,OFICIAL,RURAL,ABIERTA,BILINGUE,MATUTINA,DIARIO(REGULAR),ALTA VERAPAZ
16-01-0234-43,16-035,ALTA VERAPAZ,COBAN,EORM COMUNIDAD SAPALAU SAMUTZI,COMUNIDAD SAPALAU SAMUTZI,79512482,MARBIN ARIEL CHOC CAAL,RAUL YAT ICAL,PRIMARIA,OFICIAL,RURAL,ABIERTA,BILINGUE,MATUTINA,DIARIO(REGULAR),ALTA VERAPAZ
16-01-0235-43,16-035,ALTA VERAPAZ,COBAN,EORM COMUNIDAD SATAÑO,COMUNIDAD SATAÑO I,31685824,MARBIN ARIEL CHOC CAAL,ANA CRISTINA XÓ SAQUIJ,PRIMARIA,OFICIAL,RURAL,ABIERTA,BILINGUE,MATUTINA,DIARIO(REGULAR),ALTA VERAPAZ
16-01-0236-43,16-034,ALTA VERAPAZ,COBAN,EORM CASERIO SATAÑO II,CASERIO SATAÑO II,40995110,FELIPE CHO TUT,ASANDRINO CUCUL CAAL,PRIMARIA,OFICIAL,RURAL,ABIERTA,BILINGUE,MATUTINA,DIARIO(REGULAR),ALTA VERAPAZ
16-01-0237-43,16-002,ALTA VERAPAZ,COBAN,EORM COMUNIDAD CHIBULBUT,COMUNIDAD CHIBULBUT,46935121,MOISES ADRIAN LOPEZ PEREZ,NIDIA MAGALY CAO CAB,PRIMARIA,OFICIAL,RURAL,ABIERTA,BILINGUE,MATUTINA,DIARIO(REGULAR),ALTA VERAPAZ
16-01-0238-43,16-034,ALTA VERAPAZ,COBAN,EORM,COMUNIDAD DOLORES GUADALUPE,,FELIPE CHO TUT,FREDDY FERNANDO AREVALO MEMBREÑO,PRIMARIA,OFICIAL,RURAL,ABIERTA,BILINGUE,MATUTINA,DIARIO(REGULAR),ALTA VERAPAZ
16-01-0239-43,16-035,ALTA VERAPAZ,COBAN,EORM,CASERÍO CHINASAYUB,47987492,MARBIN ARIEL CHOC CAAL,HUGO FERNANDO YAT QUIIX,PRIMARIA,OFICIAL,RURAL,ABIERTA,BILINGUE,MATUTINA,DIARIO(REGULAR),ALTA VERAPAZ
16-01-0240-43,16-034,ALTA VERAPAZ,COBAN,EORM,COMUNIDAD DOLORES,31994361,FELIPE CHO TUT,GERMAN ORLANDO AC GARCIA,PRIMARIA,OFICIAL,RURAL,ABIERTA,BILINGUE,MATUTINA,DIARIO(REGULAR),ALTA VERAPAZ
16-01-0241-43,16-034,ALTA VERAPAZ,COBAN,EORM COMUNIDAD ROKJA SATZAC,COMUNIDAD ROCJA TZAC,53539262,FELIPE CHO TUT,RENÉ CÚ CAAL,PRIMARIA,OFICIAL,RURAL,ABIERTA,BILINGUE,MATUTINA,DIARIO(REGULAR),ALTA VERAPAZ
16-01-0242-43,16-034,ALTA VERAPAZ,COBAN,EORM,COMUNIDAD RUBEL YUM,,FELIPE CHO TUT,HUMBERTO HOENES CATÚN,PRIMARIA,OFICIAL,RURAL,ABIERTA,BILINGUE,MATUTINA,DIARIO(REGULAR),ALTA VERAPAZ
16-01-0243-43,16-002,ALTA VERAPAZ,COBAN,EORM COMUNIDAD CHIONON,ALDEA CHIONON,79512482,MOISES ADRIAN LOPEZ PEREZ,NESTOR ADOLFO BOL MACZ,PRIMARIA,OFICIAL,RURAL,ABIERTA,BILINGUE,MATUTINA,DIARIO(REGULAR),ALTA VERAPAZ
16-01-0244-43,16-003,ALTA VERAPAZ,COBAN,EORM,COMUNIDAD CAMPUR,51865337,JOSE ARTURO CHOC CHEN,IRMA MARGARITA GUERRERO CAAL,PRIMARIA,OFICIAL,RURAL,ABIERTA,BILINGUE,MATUTINA,DIARIO(REGULAR),ALTA VERAPAZ
16-01-0245-43,16-004,ALTA VERAPAZ,COBAN,EORM COMUNIDAD SANTA MARTA SALINAS,ALDEA SANTA MARTA SALINAS,57531913,AQUILES GIOVANI BAC GUEVARA,ANTONIO CHOC MAY,PRIMARIA,OFICIAL,RURAL,ABIERTA,BILINGUE,MATUTINA,DIARIO(REGULAR),ALTA VERAPAZ
16-01-0246-43,16-034,ALTA VERAPAZ,COBAN,EORM,COMUNIDAD SANTA MARTA CHIBENTZUL,,FELIPE CHO TUT,ANA LETICIA TZÍ COC,PRIMARIA,OFICIAL,RURAL,ABIERTA,BILINGUE,MATUTINA,DIARIO(REGULAR),ALTA VERAPAZ
16-01-0247-43,16-004,ALTA VERAPAZ,COBAN,EORM,BALDIO ZAPOTAL I,57573912,AQUILES GIOVANI BAC GUEVARA,HENRY JONATAN HERNÁNDEZ GONZÁLEZ,PRIMARIA,OFICIAL,RURAL,ABIERTA,BILINGUE,MATUTINA,DIARIO(REGULAR),ALTA VERAPAZ
16-01-0248-43,16-034,ALTA VERAPAZ,COBAN,EORM CASERIO SANTA VALERIA,CASERIO SANTA VALERIA,,FELIPE CHO TUT,ARTURO CHOC PANA,PRIMARIA,OFICIAL,RURAL,ABIERTA,BILINGUE,MATUTINA,DIARIO(REGULAR),ALTA VERAPAZ
16-01-0249-43,16-037,ALTA VERAPAZ,COBAN,EORM,COMUNIDAD CHUMILA IXILA II,,CESAR RIGOBERTO CUC CAAL,OTTO GONZÁLEZ,PRIMARIA,OFICIAL,RURAL,ABIERTA,BILINGUE,MATUTINA,DIARIO(REGULAR),ALTA VERAPAZ
16-01-0250-43,16-004,ALTA VERAPAZ,COBAN,EORM,ALDEA LAS PROMESAS NUEVE CERROS,,AQUILES GIOVANI BAC GUEVARA,DOMINGO CHUB CHOCOJ,PRIMARIA,OFICIAL,RURAL,ABIERTA,BILINGUE,MATUTINA,DIARIO(REGULAR),ALTA VERAPAZ
16-01-0251-43,16-004,ALTA VERAPAZ,COBAN,EORM,COMUNIDAD PIE DEL CERRO,,AQUILES GIOVANI BAC GUEVARA,RAYMUNDO YAXCAL CHOC,PRIMARIA,OFICIAL,RURAL,ABIERTA,BILINGUE,MATUTINA,DIARIO(REGULAR),ALTA VERAPAZ
16-01-0252-43,16-037,ALTA VERAPAZ,COBAN,EORM,COMUNIDAD SAN JOSE SAYHA,51529134,CESAR RIGOBERTO CUC CAAL,DORA CRISTINA LÍ POP,PRIMARIA,OFICIAL,RURAL,ABIERTA,BILINGUE,MATUTINA,DIARIO(REGULAR),ALTA VERAPAZ
16-01-0253-43,16-034,ALTA VERAPAZ,COBAN,EORM ALDEA LAS PIMIENTAS,ALDEA LAS PIMIENTAS,,FELIPE CHO TUT,HUMBERTO ITZ ICAL,PRIMARIA,OFICIAL,RURAL,ABIERTA,BILINGUE,MATUTINA,DIARIO(REGULAR),ALTA VERAPAZ
16-01-0254-43,16-037,ALTA VERAPAZ,COBAN,EORM,COMUNIDAD LA LIBERTAD XALA-ROCJA,,CESAR RIGOBERTO CUC CAAL,GERARDO CHUB IBARRA,PRIMARIA,OFICIAL,RURAL,ABIERTA,BILINGUE,MATUTINA,DIARIO(REGULAR),ALTA VERAPAZ
16-01-0255-43,16-004,ALTA VERAPAZ,COBAN,EORM,COMUNIDAD SANTA CRUZ EL NACIMIENTO,46238104,AQUILES GIOVANI BAC GUEVARA,DOMINGO COY CAAL,PRIMARIA,OFICIAL,RURAL,ABIERTA,BILINGUE,MATUTINA,DIARIO(REGULAR),ALTA VERAPAZ
16-01-0256-43,16-037,ALTA VERAPAZ,COBAN,EORM,ALDEA ROC-HA PURIBAL,40384250,CESAR RIGOBERTO CUC CAAL,RICARDO PAAU XOL,PRIMARIA,OFICIAL,RURAL,ABIERTA,BILINGUE,MATUTINA,DIARIO(REGULAR),ALTA VERAPAZ
16-01-0257-43,16-037,ALTA VERAPAZ,COBAN,EORM,ALDEA SAN PEDRO XALA-ROCJA,45105055,CESAR RIGOBERTO CUC CAAL,HECTOR HUGO COY PACAY,PRIMARIA,OFICIAL,RURAL,ABIERTA,BILINGUE,MATUTINA,DIARIO(REGULAR),ALTA VERAPAZ
16-01-0258-43,16-037,ALTA VERAPAZ,COBAN,EORM,CASERÍO SANTA ELENA SATOLOOX,48721790,CESAR RIGOBERTO CUC CAAL,HILARIO TIUL COY,PRIMARIA,OFICIAL,RURAL,ABIERTA,BILINGUE,MATUTINA,DIARIO(REGULAR),ALTA VERAPAZ
16-01-0259-43,16-037,ALTA VERAPAZ,COBAN,EORM,ALDEA CHINAMOCOCH,,CESAR RIGOBERTO CUC CAAL,ROBERTO POOU CHOC,PRIMARIA,OFICIAL,RURAL,ABIERTA,BILINGUE,MATUTINA,DIARIO(REGULAR),ALTA VERAPAZ
16-01-0260-43,16-037,ALTA VERAPAZ,COBAN,EORM,ALDEA CUXPEMECH COPALHA,48349826,CESAR RIGOBERTO CUC CAAL,ALFONSO CAAL,PRIMARIA,OFICIAL,RURAL,ABIERTA,BILINGUE,MATUTINA,DIARIO(REGULAR),ALTA VERAPAZ
16-01-0261-43,16-037,ALTA VERAPAZ,COBAN,EORM,COMUNIDAD SANTA MARTA PASUCUC,,CESAR RIGOBERTO CUC CAAL,JUAN ANTONIO CATÚN LÓPEZ,PRIMARIA,OFICIAL,RURAL,ABIERTA,BILINGUE,MATUTINA,DIARIO(REGULAR),ALTA VERAPAZ
16-01-0262-43,16-034,ALTA VERAPAZ,COBAN,EORM ALDEA CHINABOQUIL,ALDEA CHINABOQUIL,,FELIPE CHO TUT,LUCIA XOL BATZ,PRIMARIA,OFICIAL,RURAL,ABIERTA,BILINGUE,MATUTINA,DIARIO(REGULAR),ALTA VERAPAZ
16-01-0263-43,16-034,ALTA VERAPAZ,COBAN,EORM COMUNIDAD SACOYOU,ALDEA SACOYOU,79512482,FELIPE CHO TUT,RUBEN DARIO COY PAAU,PRIMARIA,OFICIAL,RURAL,ABIERTA,BILINGUE,MATUTINA,DIARIO(REGULAR),ALTA VERAPAZ
16-01-0264-43,16-034,ALTA VERAPAZ,COBAN,EORM,COMUNIDAD FAISAN II,79512482,FELIPE CHO TUT,NICOLAS CHE SAQUI,PRIMARIA,OFICIAL,RURAL,ABIERTA,BILINGUE,MATUTINA,DIARIO(REGULAR),ALTA VERAPAZ
16-01-0265-43,16-003,ALTA VERAPAZ,COBAN,EORM COMUNIDAD UCULA,COMUNIDAD UCULA,46645462,JOSE ARTURO CHOC CHEN,MIGUEL CHOC CUCUL,PRIMARIA,OFICIAL,RURAL,ABIERTA,BILINGUE,MATUTINA,DIARIO(REGULAR),ALTA VERAPAZ
16-01-0266-43,16-003,ALTA VERAPAZ,COBAN,EORM,COMUNIDAD SANTA ELENA SAMANZANA,39268238,JOSE ARTURO CHOC CHEN,MARISA IVONNE CANTORAL CHOCOOJ,PRIMARIA,OFICIAL,RURAL,ABIERTA,BILINGUE,MATUTINA,DIARIO(REGULAR),ALTA VERAPAZ
16-01-0267-43,16-004,ALTA VERAPAZ,COBAN,EORM,COMUNIDAD NUEVO AMANECER EL PLAN,79512482,AQUILES GIOVANI BAC GUEVARA,CARLOS CHOCOJ SAM,PRIMARIA,OFICIAL,RURAL,ABIERTA,BILINGUE,MATUTINA,DIARIO(REGULAR),ALTA VERAPAZ
16-01-0268-43,16-034,ALTA VERAPAZ,COBAN,EORM CASERIO SACTELA,CASERIO SACTELA,79512482,FELIPE CHO TUT,MANUEL RAX CUC,PRIMARIA,OFICIAL,RURAL,ABIERTA,BILINGUE,MATUTINA,DIARIO(REGULAR),ALTA VERAPAZ
16-01-0269-43,16-034,ALTA VERAPAZ,COBAN,EORM,CASERIO ISRAEL,57809619,FELIPE CHO TUT,FELIPE SACBÁ POP,PRIMARIA,OFICIAL,RURAL,ABIERTA,BILINGUE,MATUTINA,DIARIO(REGULAR),ALTA VERAPAZ
16-01-0270-43,16-035,ALTA VERAPAZ,COBAN,EORM CASERIO XBEN CONOP II,CASERIO XBEN CONOP II,49905570,MARBIN ARIEL CHOC CAAL,ALFREDO XOL CUCUL,PRIMARIA,OFICIAL,RURAL,ABIERTA,BILINGUE,MATUTINA,DIARIO(REGULAR),ALTA VERAPAZ
16-01-0271-43,16-002,ALTA VERAPAZ,COBAN,EORM COMUNIDAD CAQUIPEC SATEX,COMUNIDAD CAQUIPEC SATEX,49044952,MOISES ADRIAN LOPEZ PEREZ,MARILYN GEOVANNA TOT PONCE,PRIMARIA,OFICIAL,RURAL,ABIERTA,BILINGUE,MATUTINA,DIARIO(REGULAR),ALTA VERAPAZ
16-01-0272-43,16-003,ALTA VERAPAZ,COBAN,EORM,COMUNIDAD CHITOCAN,52068820,JOSE ARTURO CHOC CHEN,JOSE EFRAIN COL CUCUL,PRIMARIA,OFICIAL,RURAL,ABIERTA,BILINGUE,MATUTINA,DIARIO(REGULAR),ALTA VERAPAZ
16-01-0273-43,16-034,ALTA VERAPAZ,COBAN,EORM,COMUNIDAD CAQUIJA,79512482,FELIPE CHO TUT,RIGOBERTO BATZ POP,PRIMARIA,OFICIAL,RURAL,ABIERTA,BILINGUE,MATUTINA,DIARIO(REGULAR),ALTA VERAPAZ
16-01-0274-43,16-003,ALTA VERAPAZ,COBAN,EORM,COMUNIDAD SECAK CUXCALA,53319005,JOSE ARTURO CHOC CHEN,FRANCISCO CHOCOOJ CHE,PRIMARIA,OFICIAL,RURAL,ABIERTA,BILINGUE,MATUTINA,DIARIO(REGULAR),ALTA VERAPAZ
16-01-0275-43,16-003,ALTA VERAPAZ,COBAN,EORM ALDEA SAYAXUT I,ALDEA SAYAXUT I,,JOSE ARTURO CHOC CHEN,DALILA NOHEMI LEIVA POP,PRIMARIA,OFICIAL,RURAL,ABIERTA,BILINGUE,MATUTINA,DIARIO(REGULAR),ALTA VERAPAZ
16-01-0276-43,16-003,ALTA VERAPAZ,COBAN,EORM ALDEA INUPAL,ALDEA INUPAL,30549247,JOSE ARTURO CHOC CHEN,VICTOR YAXCAL CAAL,PRIMARIA,OFICIAL,RURAL,ABIERTA,BILINGUE,MATUTINA,DIARIO(REGULAR),ALTA VERAPAZ
16-01-0277-43,16-037,ALTA VERAPAZ,COBAN,EORM BALDÍO XALACHÉ,BALDIO XALACHE,,CESAR RIGOBERTO CUC CAAL,GARY ABSALON MEDINA PRADO,PRIMARIA,OFICIAL,RURAL,ABIERTA,BILINGUE,MATUTINA,DIARIO(REGULAR),ALTA VERAPAZ
16-01-0278-43,16-037,ALTA VERAPAZ,COBAN,EORM,ALDEA SAJACOC XALASUTZUL,51552934,CESAR RIGOBERTO CUC CAAL,MARTHA ABIGAIL MEJÍA XUC,PRIMARIA,OFICIAL,RURAL,ABIERTA,BILINGUE,MATUTINA,DIARIO(REGULAR),ALTA VERAPAZ
16-01-0279-43,16-034,ALTA VERAPAZ,COBAN,EORM,CASERÍO ROCJA TZIN,38266339,FELIPE CHO TUT,MÓNICA CAROLINA POP PÉREZ,PRIMARIA,OFICIAL,RURAL,ABIERTA,BILINGUE,MATUTINA,DIARIO(REGULAR),ALTA VERAPAZ
16-01-0280-43,16-004,ALTA VERAPAZ,COBAN,EORM,ALDEA SAN LUIS PLAYA GRANDE,58998270,AQUILES GIOVANI BAC GUEVARA,ERINEO FRANCISCO MEJÍA BATÉN,PRIMARIA,OFICIAL,RURAL,ABIERTA,BILINGUE,MATUTINA,DIARIO(REGULAR),ALTA VERAPAZ
16-01-0281-43,16-004,ALTA VERAPAZ,COBAN,EORM,CASERIO ENTRE RIOS,,AQUILES GIOVANI BAC GUEVARA,FELIX COC YALIBAT,PRIMARIA,OFICIAL,RURAL,ABIERTA,BILINGUE,MATUTINA,DIARIO(REGULAR),ALTA VERAPAZ
16-01-0282-43,16-003,ALTA VERAPAZ,COBAN,EORM,ALDEA CERRO VERDE,,JOSE ARTURO CHOC CHEN,ELENA FLORICELDA DEL VALLE SACUL,PRIMARIA,OFICIAL,RURAL,ABIERTA,BILINGUE,MATUTINA,DIARIO(REGULAR),ALTA VERAPAZ
16-01-0283-43,16-047,ALTA VERAPAZ,COBAN,EORM COMUNIDAD CHICHAJ,COMUNIDAD CHICHAJ,47775922,ERNESTO CAAL CHOC,ONELIA OBDULIA TZUL SAM,PRIMARIA,OFICIAL,RURAL,ABIERTA,BILINGUE,MATUTINA,DIARIO(REGULAR),ALTA VERAPAZ
16-01-0284-43,16-047,ALTA VERAPAZ,COBAN,EORM,CASERIO PURAHUB,47791882,ERNESTO CAAL CHOC,MARCOS CAJBÓN,PRIMARIA,OFICIAL,RURAL,ABIERTA,BILINGUE,MATUTINA,DIARIO(REGULAR),ALTA VERAPAZ
16-01-0285-43,16-047,ALTA VERAPAZ,COBAN,EORM,COMUNIDAD SECANAIX,40414869,ERNESTO CAAL CHOC,SCARLETH PRISCILLA CABALLEROS CORONADO,PRIMARIA,OFICIAL,RURAL,ABIERTA,BILINGUE,MATUTINA,DIARIO(REGULAR),ALTA VERAPAZ
16-01-0286-43,16-035,ALTA VERAPAZ,COBAN,EORM COMUNIDAD XBEN TZUL CONOP III,COMUNIDAD XBEN TZUL CONOP III,79512482,MARBIN ARIEL CHOC CAAL,ROBERTO ICAL PEREZ,PRIMARIA,OFICIAL,RURAL,ABIERTA,BILINGUE,MATUTINA,DIARIO(REGULAR),ALTA VERAPAZ
