16-12-2784-43,16-023,ALTA VERAPAZ,SANTA MARIA CAHABON,EORM,ALDEA SESALTUL,,ELVIS BENJAMÍN IXÍM HERNANDEZ,AMILCAR RIGOBERTO CAAL XOL,PRIMARIA,OFICIAL,RURAL,ABIERTA,BILINGUE,MATUTINA,DIARIO(REGULAR),ALTA VERAPAZ
16-12-2786-43,16-023,ALTA VERAPAZ,SANTA MARIA CAHABON,EORM,CASERIO SEPUR,30098789,ELVIS BENJAMÍN IXÍM HERNANDEZ,DOUGLAS EDINSON SACUL CAAL,PRIMARIA,OFICIAL,RURAL,ABIERTA,BILINGUE,MATUTINA,DIARIO(REGULAR),ALTA VERAPAZ
16-12-6421-43,16-022,ALTA VERAPAZ,SANTA MARIA CAHABON,EORM,ALDEA BELEN,44996708,HORACIO WALDEMAR JUÁREZ ARGUETA,WALTER LÓPEZ COC,PRIMARIA,OFICIAL,RURAL,ABIERTA,BILINGUE,MATUTINA,DIARIO(REGULAR),ALTA VERAPAZ
16-12-6961-43,16-022,ALTA VERAPAZ,SANTA MARIA CAHABON,EORM,CASERIO SANTA CRUZ XOBALAM,31403900,HORACIO WALDEMAR JUÁREZ ARGUETA,HENRY ARAEL JÓ CHOCO,PRIMARIA,OFICIAL,RURAL,ABIERTA,BILINGUE,MATUTINA,DIARIO(REGULAR),ALTA VERAPAZ
16-12-7041-43,16-023,ALTA VERAPAZ,SANTA MARIA CAHABON,EORM,ALDEA RUBEL BALAM,50335243,ELVIS BENJAMÍN IXÍM HERNANDEZ,RICARDO DE JESUS CHOLOM CUZ,PRIMARIA,OFICIAL,RURAL,ABIERTA,BILINGUE,MATUTINA,DIARIO(REGULAR),ALTA VERAPAZ
16-12-7043-43,16-022,ALTA VERAPAZ,SANTA MARIA CAHABON,EORM,CASERIO SAN JOSE CANIHOR,,HORACIO WALDEMAR JUÁREZ ARGUETA,HERTA WOHLERS ARGUETA,PRIMARIA,OFICIAL,RURAL,ABIERTA,BILINGUE,MATUTINA,DIARIO(REGULAR),ALTA VERAPAZ
16-12-7115-43,16-022,ALTA VERAPAZ,SANTA MARIA CAHABON,EORM,ALDEA TUZBILPEC,,HORACIO WALDEMAR JUÁREZ ARGUETA,JOSE ANTONIO ESTRADA CHIQUIN,PRIMARIA,OFICIAL,RURAL,ABIERTA,BILINGUE,MATUTINA,DIARIO(REGULAR),ALTA VERAPAZ
16-12-7898-43,16-022,ALTA VERAPAZ,SANTA MARIA CAHABON,EORM,CASERIO SAN JACINTO,57464316,HORACIO WALDEMAR JUÁREZ ARGUETA,JUAN CARLOS CHOC,PRIMARIA,OFICIAL,RURAL,ABIERTA,BILINGUE,MATUTINA,DIARIO(REGULAR),ALTA VERAPAZ
16-12-8190-43,16-022,ALTA VERAPAZ,SANTA MARIA CAHABON,EORM,CASERIO SANTO DOMINGO RUBELTZUL,45607402,HORACIO WALDEMAR JUÁREZ ARGUETA,RUDY DANIEL COY IXIM,PRIMARIA,OFICIAL,RURAL,ABIERTA,BILINGUE,MATUTINA,DIARIO(REGULAR),ALTA VERAPAZ
16-12-8256-43,16-023,ALTA VERAPAZ,SANTA MARIA CAHABON,EORM,ALDEA GUALIBAJ UNO,31856226,ELVIS BENJAMÍN IXÍM HERNANDEZ,DEYBY RODERICO CACAO BARRIENTOS,PRIMARIA,OFICIAL,RURAL,ABIERTA,BILINGUE,MATUTINA,DIARIO(REGULAR),ALTA VERAPAZ
16-12-8539-43,16-023,ALTA VERAPAZ,SANTA MARIA CAHABON,EORM,CASERIO CHILAJAB,,ELVIS BENJAMÍN IXÍM HERNANDEZ,JUAN BERNARDO SECUNDINO IXIM CHUB,PRIMARIA,OFICIAL,RURAL,ABIERTA,BILINGUE,MATUTINA,DIARIO(REGULAR),ALTA VERAPAZ
16-12-9106-43,16-022,ALTA VERAPAZ,SANTA MARIA CAHABON,EORM,CASERIO SANTO DOMINGO SECTOR II,45924769,HORACIO WALDEMAR JUÁREZ ARGUETA,ELSA ORALIA CAJ MO,PRIMARIA,OFICIAL,RURAL,ABIERTA,BILINGUE,MATUTINA,DIARIO(REGULAR),ALTA VERAPAZ
16-12-9896-43,16-022,ALTA VERAPAZ,SANTA MARIA CAHABON,CENTRO DE ESTUDIOS PREUNIVERSITARIO CAHABÓN -CEPREC-,BARRIO SAN PABLO,45353648,HORACIO WALDEMAR JUÁREZ ARGUETA,ERNESTO YAXCAL CUZ,PRIMARIA,PRIVADO,URBANA,ABIERTA,BILINGUE,MATUTINA,DIARIO(REGULAR),ALTA VERAPAZ
16-12-9992-43,16-023,ALTA VERAPAZ,SANTA MARIA CAHABON,EORM,CASERIO PE&A BLANCA,57818130,ELVIS BENJAMÍN IXÍM HERNANDEZ,FERDYN ALÉXAR BARRIENTOS LÓPEZ,PRIMARIA,OFICIAL,RURAL,ABIERTA,BILINGUE,MATUTINA,DIARIO(REGULAR),ALTA VERAPAZ
16-13-0046-43,16-045,ALTA VERAPAZ,CHISEC,EORM,COMUNIDAD SEMOX YALICAR,,ALFONSO BOTZOC CAN,VICTORIANO TZÍ COC,PRIMARIA,OFICIAL,RURAL,ABIERTA,BILINGUE,MATUTINA,DIARIO(REGULAR),ALTA VERAPAZ
16-13-0047-43,16-045,ALTA VERAPAZ,CHISEC,EORM COMUNIDAD SANTA LUCÍA CAJCAN,COMUNIDAD SANTA LUCIA CAJCAN,32410349,ALFONSO BOTZOC CAN,VALENTÍN TIUL COC,PRIMARIA,OFICIAL,RURAL,ABIERTA,BILINGUE,MATUTINA,DIARIO(REGULAR),ALTA VERAPAZ
16-13-0048-43,16-025,ALTA VERAPAZ,CHISEC,EORM,COMUNIDAD TIERRA NEGRA II,30596544,CARLOS ARMANDO PAAÚ TZÍ,WALTHER NERY GARCÍA GARCÍA,PRIMARIA,OFICIAL,RURAL,ABIERTA,BILINGUE,MATUTINA,DIARIO(REGULAR),ALTA VERAPAZ
16-13-0049-43,16-025,ALTA VERAPAZ,CHISEC,EORM COMUNIDAD CANLECH,COMUNIDAD CANLECH,45732254,CARLOS ARMANDO PAAÚ TZÍ,ELISEO FERNANDO CÚ ICO,PRIMARIA,OFICIAL,RURAL,ABIERTA,BILINGUE,MATUTINA,DIARIO(REGULAR),ALTA VERAPAZ
16-13-0052-43,16-025,ALTA VERAPAZ,CHISEC,EORM,ALDEA CRUCE DEL PATO,32127953,CARLOS ARMANDO PAAÚ TZÍ,DAVID CAAL ICAL,PRIMARIA,OFICIAL,RURAL,ABIERTA,BILINGUE,MATUTINA,DIARIO(REGULAR),ALTA VERAPAZ
16-13-0054-43,16-045,ALTA VERAPAZ,CHISEC,EORM,COMUNIDAD CHINAHA ZAPOTILLO,,ALFONSO BOTZOC CAN,CARLOS BOTZOC CHUB,PRIMARIA,OFICIAL,RURAL,ABIERTA,BILINGUE,MATUTINA,DIARIO(REGULAR),ALTA VERAPAZ
16-13-0056-43,16-045,ALTA VERAPAZ,CHISEC,EORM COMUNIDAD CERRO ALTO,COMUNIDAD CERRO ALTO,45301866,ALFONSO BOTZOC CAN,HUGO ROLANDO CHOC CHOC,PRIMARIA,OFICIAL,RURAL,ABIERTA,BILINGUE,MATUTINA,DIARIO(REGULAR),ALTA VERAPAZ
16-13-0058-43,16-024,ALTA VERAPAZ,CHISEC,EORM,ALDEA SEPALAU,,CESAR ROLANDO CHOCOOJ YALIBAT,KIMBERLIN DARLENE CUCUL MUCU,PRIMARIA,OFICIAL,RURAL,ABIERTA,BILINGUE,MATUTINA,DIARIO(REGULAR),ALTA VERAPAZ
16-13-0061-43,16-045,ALTA VERAPAZ,CHISEC,EORM,COMUNIDAD SEPOC CARRECHE II,48515896,ALFONSO BOTZOC CAN,HÉCTOR TUPIL GUITZ,PRIMARIA,OFICIAL,RURAL,ABIERTA,BILINGUE,MATUTINA,DIARIO(REGULAR),ALTA VERAPAZ
16-13-0062-43,16-045,ALTA VERAPAZ,CHISEC,EORM COMUNIDAD SEPOC CARRECHE I,COMUNIDAD SEPOC CARRECHE I,58957231,ALFONSO BOTZOC CAN,CARLOS CAAL CHOCOJ,PRIMARIA,OFICIAL,RURAL,ABIERTA,BILINGUE,MATUTINA,DIARIO(REGULAR),ALTA VERAPAZ
16-13-0064-43,16-025,ALTA VERAPAZ,CHISEC,EORM,COMUNIDAD CASTA LINTERNA II,,CARLOS ARMANDO PAAÚ TZÍ,ELDER GERARDO GOMEZ AREVALO,PRIMARIA,OFICIAL,RURAL,ABIERTA,BILINGUE,MATUTINA,DIARIO(REGULAR),ALTA VERAPAZ
16-13-0066-43,16-025,ALTA VERAPAZ,CHISEC,EORM COMUNIDAD CERRO AZUL,COMUNIDAD CERRO AZUL,52029109,CARLOS ARMANDO PAAÚ TZÍ,RAÚL ANTONIO CHIC VELASQUEZ,PRIMARIA,OFICIAL,RURAL,ABIERTA,BILINGUE,MATUTINA,DIARIO(REGULAR),ALTA VERAPAZ
16-13-0067-43,16-024,ALTA VERAPAZ,CHISEC,EORM,COMUNIDAD EL ESFUERZO,59029793,CESAR ROLANDO CHOCOOJ YALIBAT,CARLOS ENRIQUE SUN MAC,PRIMARIA,OFICIAL,RURAL,ABIERTA,BILINGUE,MATUTINA,DIARIO(REGULAR),ALTA VERAPAZ
16-13-0068-43,16-045,ALTA VERAPAZ,CHISEC,EORM,COMUNIDAD EL LIMÓN YALICAR,35982398,ALFONSO BOTZOC CAN,DANIEL OLIVERIO TZI CHUB,PRIMARIA,OFICIAL,RURAL,ABIERTA,BILINGUE,MATUTINA,DIARIO(REGULAR),ALTA VERAPAZ
16-13-0069-43,16-025,ALTA VERAPAZ,CHISEC,EORM COMUNIDAD LA LIBERTAD,COMUNIDAD LA LIBERTAD,,CARLOS ARMANDO PAAÚ TZÍ,HECTOR ROLANDO CHUB CHE,PRIMARIA,OFICIAL,RURAL,ABIERTA,BILINGUE,MATUTINA,DIARIO(REGULAR),ALTA VERAPAZ
16-13-0071-43,16-025,ALTA VERAPAZ,CHISEC,EORM,COMUNIDAD LAS MERCEDES I,,CARLOS ARMANDO PAAÚ TZÍ,CARLOS ERIK CAAL COY,PRIMARIA,OFICIAL,RURAL,ABIERTA,BILINGUE,MATUTINA,DIARIO(REGULAR),ALTA VERAPAZ
16-13-0073-43,16-025,ALTA VERAPAZ,CHISEC,EORM,COMUNIDAD NUEVA BABILONIA,46143142,CARLOS ARMANDO PAAÚ TZÍ,FLORIDALMA GRAVE SUNÚN,PRIMARIA,OFICIAL,RURAL,ABIERTA,BILINGUE,MATUTINA,DIARIO(REGULAR),ALTA VERAPAZ
16-13-0074-43,16-025,ALTA VERAPAZ,CHISEC,EORM,COMUNIDAD NUEVA SAMARITANA,51568227,CARLOS ARMANDO PAAÚ TZÍ,GREGORIO TOT CHOC,PRIMARIA,OFICIAL,RURAL,ABIERTA,BILINGUE,MATUTINA,DIARIO(REGULAR),ALTA VERAPAZ
16-13-0076-43,16-025,ALTA VERAPAZ,CHISEC,EORM COMUNIDAD RIO MUCBILHA II,COMUNIDAD RIO MUCBILHA II,,CARLOS ARMANDO PAAÚ TZÍ,RAUL HUMBERTO ICAL CUCUL,PRIMARIA,OFICIAL,RURAL,ABIERTA,BILINGUE,MATUTINA,DIARIO(REGULAR),ALTA VERAPAZ
16-13-0077-43,16-024,ALTA VERAPAZ,CHISEC,EORM COMUNIDAD SAN FRANCISCO,COMUNIDAD SAN FRANCISCO,46650106,CESAR ROLANDO CHOCOOJ YALIBAT,ABRAHAM POP MAQUIN,PRIMARIA,OFICIAL,RURAL,ABIERTA,BILINGUE,MATUTINA,DIARIO(REGULAR),ALTA VERAPAZ
16-13-0079-43,16-025,ALTA VERAPAZ,CHISEC,EORM COMUNIDAD SAN LUIS CHIQUITO,COMUNIDAD SAN LUIS CHIQUITO,,CARLOS ARMANDO PAAÚ TZÍ,MANUEL DE JESUS COY QUIB,PRIMARIA,OFICIAL,RURAL,ABIERTA,BILINGUE,MATUTINA,DIARIO(REGULAR),ALTA VERAPAZ
16-13-0080-43,16-025,ALTA VERAPAZ,CHISEC,EORM COMUNIDAD SAN LUIS ICBOLAY,COMUNIDAD SAN LUIS ICBOLAY,58199014,CARLOS ARMANDO PAAÚ TZÍ,OSCAR ARNOLDO TEJAX YOS,PRIMARIA,OFICIAL,RURAL,ABIERTA,BILINGUE,MATUTINA,DIARIO(REGULAR),ALTA VERAPAZ
16-13-0081-43,16-045,ALTA VERAPAZ,CHISEC,EORM COMUNIDAD SEHUBUB SERAXQUEN,COMUNIDAD SEHUBUB SERAXQUEN,,ALFONSO BOTZOC CAN,GENARO CAAL TIUL,PRIMARIA,OFICIAL,RURAL,ABIERTA,BILINGUE,MATUTINA,DIARIO(REGULAR),ALTA VERAPAZ
16-13-0082-43,16-025,ALTA VERAPAZ,CHISEC,EORM,COMUNIDAD SAN PEDRO LIMON,44989255,CARLOS ARMANDO PAAÚ TZÍ,JOSÉ CORNELIO TZIB CAZ,PRIMARIA,OFICIAL,RURAL,ABIERTA,BILINGUE,MATUTINA,DIARIO(REGULAR),ALTA VERAPAZ
16-13-0084-43,16-045,ALTA VERAPAZ,CHISEC,EORM COMUNIDAD RUBEL HÓ,COMUNIDAD RUBEL HO,51727975,ALFONSO BOTZOC CAN,MATEO CHUB CHUB,PRIMARIA,OFICIAL,RURAL,ABIERTA,BILINGUE,MATUTINA,DIARIO(REGULAR),ALTA VERAPAZ
16-13-0086-43,16-025,ALTA VERAPAZ,CHISEC,EORM,COMUNIDAD ESPERANCITA DEL RIO,33238522,CARLOS ARMANDO PAAÚ TZÍ,ENRIQUE MÓ CHÉ,PRIMARIA,OFICIAL,RURAL,ABIERTA,BILINGUE,MATUTINA,DIARIO(REGULAR),ALTA VERAPAZ
16-13-0088-43,16-045,ALTA VERAPAZ,CHISEC,EORM,CASERIO CAMPOSANTO II,,ALFONSO BOTZOC CAN,VICTOR HUGO COC CHUB,PRIMARIA,OFICIAL,RURAL,ABIERTA,BILINGUE,MATUTINA,DIARIO(REGULAR),ALTA VERAPAZ
16-13-0089-43,16-045,ALTA VERAPAZ,CHISEC,EORM COMUNIDAD PECUILIX,COMUNIDAD PECUILIX,49373015,ALFONSO BOTZOC CAN,MIRIAM FAVIOLA CHOC MAAS,PRIMARIA,OFICIAL,RURAL,ABIERTA,BILINGUE,MATUTINA,DIARIO(REGULAR),ALTA VERAPAZ
16-13-0090-43,16-025,ALTA VERAPAZ,CHISEC,EORM,COMUNIDAD TIERRA NEGRA I,,CARLOS ARMANDO PAAÚ TZÍ,RICARDO CHUB CAAL,PRIMARIA,OFICIAL,RURAL,ABIERTA,BILINGUE,MATUTINA,DIARIO(REGULAR),ALTA VERAPAZ
16-13-0091-43,16-025,ALTA VERAPAZ,CHISEC,EORM,COMUNIDAD TZLUL Q´EQCHÍ,,CARLOS ARMANDO PAAÚ TZÍ,PEDRO CAAL CACAO,PRIMARIA,OFICIAL,RURAL,ABIERTA,BILINGUE,MATUTINA,DIARIO(REGULAR),ALTA VERAPAZ
16-13-0092-43,16-045,ALTA VERAPAZ,CHISEC,EORM COMUNIDAD LAS CRUCES DEL NORTE,COMUNIDAD LAS CRUCES DEL NORTE,,ALFONSO BOTZOC CAN,MARCOS COC TIUL,PRIMARIA,OFICIAL,RURAL,ABIERTA,BILINGUE,MATUTINA,DIARIO(REGULAR),ALTA VERAPAZ
16-13-0093-43,16-025,ALTA VERAPAZ,CHISEC,EORM,COMUNIDAD LAS PROMESAS I,30537808,CARLOS ARMANDO PAAÚ TZÍ,ENRIQUE POOB CHOC,PRIMARIA,OFICIAL,RURAL,ABIERTA,BILINGUE,MATUTINA,DIARIO(REGULAR),ALTA VERAPAZ
16-13-0094-43,16-045,ALTA VERAPAZ,CHISEC,EORM,COMUNIDAD SERAXQUEN CAJCAN,,ALFONSO BOTZOC CAN,OSCAR CHUB CHOLOM,PRIMARIA,OFICIAL,RURAL,ABIERTA,BILINGUE,MATUTINA,DIARIO(REGULAR),ALTA VERAPAZ
16-13-0095-43,16-045,ALTA VERAPAZ,CHISEC,EORM COMUNIDAD LAS ROCAS,COMUNIDAD LAS ROCAS,47844093,ALFONSO BOTZOC CAN,RAMIRO CHOC CANTI,PRIMARIA,OFICIAL,RURAL,ABIERTA,BILINGUE,MATUTINA,DIARIO(REGULAR),ALTA VERAPAZ
16-13-0096-43,16-045,ALTA VERAPAZ,CHISEC,EORM,COMUNIDAD SEHIX,33078937,ALFONSO BOTZOC CAN,EUSEBIO TIUL COC,PRIMARIA,OFICIAL,RURAL,ABIERTA,BILINGUE,MATUTINA,DIARIO(REGULAR),ALTA VERAPAZ
16-13-0097-43,16-025,ALTA VERAPAZ,CHISEC,EORM COMUNIDAD VERAPAZ,COMUNIDAD VERAPAZ,46584641,CARLOS ARMANDO PAAÚ TZÍ,CLAUDIA ESPERANZA MEZ XOL,PRIMARIA,OFICIAL,RURAL,ABIERTA,BILINGUE,MATUTINA,DIARIO(REGULAR),ALTA VERAPAZ
16-13-0099-43,16-045,ALTA VERAPAZ,CHISEC,EORM,COMUNIDAD RINCONCITO DEL NORTE,58066760,ALFONSO BOTZOC CAN,ROGELIO CHEN ICHICH,PRIMARIA,OFICIAL,RURAL,ABIERTA,BILINGUE,MATUTINA,DIARIO(REGULAR),ALTA VERAPAZ
16-13-0101-43,16-024,ALTA VERAPAZ,CHISEC,EORM,COMUNIDAD SEGUACHIL,45294811,CESAR ROLANDO CHOCOOJ YALIBAT,JOSÉ COC ICO,PRIMARIA,OFICIAL,RURAL,ABIERTA,BILINGUE,MATUTINA,DIARIO(REGULAR),ALTA VERAPAZ
16-13-0102-43,16-025,ALTA VERAPAZ,CHISEC,EORM COMUNIDAD LAS PAPAYAS,COMUNIDAD LAS PAPAYAS,40375370,CARLOS ARMANDO PAAÚ TZÍ,MILTON WILFREDO CUN SIERRA,PRIMARIA,OFICIAL,RURAL,ABIERTA,BILINGUE,MATUTINA,DIARIO(REGULAR),ALTA VERAPAZ
16-13-0103-43,16-045,ALTA VERAPAZ,CHISEC,EORM COMUNIDAD SEPOCIL,COMUNIDAD SEPOCIL,33248687,ALFONSO BOTZOC CAN,HERMELINDO CUC CAC,PRIMARIA,OFICIAL,RURAL,ABIERTA,BILINGUE,MATUTINA,DIARIO(REGULAR),ALTA VERAPAZ
16-13-0105-43,16-045,ALTA VERAPAZ,CHISEC,EORM COMUNIDAD SECOMUXÀN II,COMUNIDAD SECOMUXAN II,57357062,ALFONSO BOTZOC CAN,FEDERICO DAMIÁN CANTI BÁ,PRIMARIA,OFICIAL,RURAL,ABIERTA,BILINGUE,MATUTINA,DIARIO(REGULAR),ALTA VERAPAZ
16-13-0108-43,16-045,ALTA VERAPAZ,CHISEC,EORM,COMUNIDAD SECOMUXAN I,46914195,ALFONSO BOTZOC CAN,RICARDO CHOC,PRIMARIA,OFICIAL,RURAL,ABIERTA,BILINGUE,MATUTINA,DIARIO(REGULAR),ALTA VERAPAZ
16-13-0111-43,16-024,ALTA VERAPAZ,CHISEC,EORM,COMUNIDAD CARECHÉ SECHINA,,CESAR ROLANDO CHOCOOJ YALIBAT,MAURILIO CHÓC CUCUL,PRIMARIA,OFICIAL,RURAL,ABIERTA,BILINGUE,MATUTINA,DIARIO(REGULAR),ALTA VERAPAZ
16-13-0112-43,16-025,ALTA VERAPAZ,CHISEC,EORM COMUNIDAD NUEVA PALESTINA I,COMUNIDAD NUEVA PALESTINA I,,CARLOS ARMANDO PAAÚ TZÍ,MARIANO POP GUALNA,PRIMARIA,OFICIAL,RURAL,ABIERTA,BILINGUE,MATUTINA,DIARIO(REGULAR),ALTA VERAPAZ
16-13-0113-43,16-025,ALTA VERAPAZ,CHISEC,EORM,COMUNIDAD NUEVO SINAÍ RUBEL SANTO,38391980,CARLOS ARMANDO PAAÚ TZÍ,CANDELARIA TOX CUC,PRIMARIA,OFICIAL,RURAL,ABIERTA,BILINGUE,MATUTINA,DIARIO(REGULAR),ALTA VERAPAZ
16-13-0115-43,16-025,ALTA VERAPAZ,CHISEC,EORM,COMUNIDAD SAN MIGUEL,46427670,CARLOS ARMANDO PAAÚ TZÍ,MIGUEL XOL CUC,PRIMARIA,OFICIAL,RURAL,ABIERTA,BILINGUE,MATUTINA,DIARIO(REGULAR),ALTA VERAPAZ
16-13-0116-43,16-025,ALTA VERAPAZ,CHISEC,EORM,COMUNIDAD CASTA LINTERNA I,48346268,CARLOS ARMANDO PAAÚ TZÍ,ROSENDO REGINALDO POP TZIR,PRIMARIA,OFICIAL,RURAL,ABIERTA,BILINGUE,MATUTINA,DIARIO(REGULAR),ALTA VERAPAZ
16-13-0119-43,16-045,ALTA VERAPAZ,CHISEC,EORM,COMUNIDAD CHINATICARIB,57620930,ALFONSO BOTZOC CAN,GABRIEL XOL TIUL,PRIMARIA,OFICIAL,RURAL,ABIERTA,BILINGUE,MATUTINA,DIARIO(REGULAR),ALTA VERAPAZ
16-13-0120-43,16-045,ALTA VERAPAZ,CHISEC,EORM COMUNIDAD GUADALUPE YALICAR,COMUNIDAD GUADALUPE YALICAR,,ALFONSO BOTZOC CAN,JOSE XOL XI,PRIMARIA,OFICIAL,RURAL,ABIERTA,BILINGUE,MATUTINA,DIARIO(REGULAR),ALTA VERAPAZ
16-13-0121-43,16-025,ALTA VERAPAZ,CHISEC,EORM COMUNIDAD POZO SECO,COMUNIDAD POZO SECO,45915230,CARLOS ARMANDO PAAÚ TZÍ,JORGE POP CHOC,PRIMARIA,OFICIAL,RURAL,ABIERTA,BILINGUE,MATUTINA,DIARIO(REGULAR),ALTA VERAPAZ
16-13-0123-43,16-045,ALTA VERAPAZ,CHISEC,EORM COMUNIDAD YALICOC,COMUNIDAD YALICOC,,ALFONSO BOTZOC CAN,RICARDO XOL CUCUL,PRIMARIA,OFICIAL,RURAL,ABIERTA,BILINGUE,MATUTINA,DIARIO(REGULAR),ALTA VERAPAZ
16-13-0124-43,16-025,ALTA VERAPAZ,CHISEC,EORM,COMUNIDAD AGUA SUBTERRANEA,40423000,CARLOS ARMANDO PAAÚ TZÍ,CARLOS HUMBERTO CAO TZUL,PRIMARIA,OFICIAL,RURAL,ABIERTA,BILINGUE,MATUTINA,DIARIO(REGULAR),ALTA VERAPAZ
16-13-0126-43,16-025,ALTA VERAPAZ,CHISEC,EORM COMUNIDAD QUIMALA,COMUNIDAD QUIMALA,31028585,CARLOS ARMANDO PAAÚ TZÍ,ANTONIO POP CÚ,PRIMARIA,OFICIAL,RURAL,ABIERTA,BILINGUE,MATUTINA,DIARIO(REGULAR),ALTA VERAPAZ
16-13-0128-43,16-025,ALTA VERAPAZ,CHISEC,EORM,COMUNIDAD LIMON NORTE,46056214,CARLOS ARMANDO PAAÚ TZÍ,PEDRO PAAU CHOC,PRIMARIA,OFICIAL,RURAL,ABIERTA,BILINGUE,MATUTINA,DIARIO(REGULAR),ALTA VERAPAZ
16-13-0131-43,16-045,ALTA VERAPAZ,CHISEC,EORM COMUNIDAD CAMPOSANTO I,COMUNIDAD CAMPO SANTO I,,ALFONSO BOTZOC CAN,RAYMUNDO CUCUL CAAL,PRIMARIA,OFICIAL,RURAL,ABIERTA,BILINGUE,MATUTINA,DIARIO(REGULAR),ALTA VERAPAZ
16-13-0132-43,16-045,ALTA VERAPAZ,CHISEC,EORM COMUNIDAD COYOMBALAM,COMUNIDAD COYOMBALAM,31848773,ALFONSO BOTZOC CAN,MARIO RENÉ YALIBAT TUN,PRIMARIA,OFICIAL,RURAL,ABIERTA,BILINGUE,MATUTINA,DIARIO(REGULAR),ALTA VERAPAZ
16-13-0133-43,16-045,ALTA VERAPAZ,CHISEC,EORM COMUNIDAD LA NUEVA ESPERANZA,COMUNIDAD LA NUEVA ESPERANZA,,ALFONSO BOTZOC CAN,MATEO CHUB GUALNA,PRIMARIA,OFICIAL,RURAL,ABIERTA,BILINGUE,MATUTINA,DIARIO(REGULAR),ALTA VERAPAZ
16-13-0136-43,16-045,ALTA VERAPAZ,CHISEC,EORM,COMUNIDAD SEMAX,,ALFONSO BOTZOC CAN,ALFREDO CACAO CHOC,PRIMARIA,OFICIAL,RURAL,ABIERTA,BILINGUE,MATUTINA,DIARIO(REGULAR),ALTA VERAPAZ
16-13-0138-43,16-045,ALTA VERAPAZ,CHISEC,EORM COMUNIDAD EL GUAPINOL,COMUNIDAD GUAPINOL,45779642,ALFONSO BOTZOC CAN,ENRIQUE CHÉ CHOCOJ,PRIMARIA,OFICIAL,RURAL,ABIERTA,BILINGUE,MATUTINA,DIARIO(REGULAR),ALTA VERAPAZ
16-13-0140-43,16-045,ALTA VERAPAZ,CHISEC,EORM,COMUNIDAD SETZAC CATALPEC,,ALFONSO BOTZOC CAN,ENRIQUE BA TIUL,PRIMARIA,OFICIAL,RURAL,ABIERTA,BILINGUE,MATUTINA,DIARIO(REGULAR),ALTA VERAPAZ
16-13-0143-43,16-045,ALTA VERAPAZ,CHISEC,EORM COMUNIDAD CATALPEC,COMUNIDAD CATALPEC,51960370,ALFONSO BOTZOC CAN,PEDRO CÚ CAAL,PRIMARIA,OFICIAL,RURAL,ABIERTA,BILINGUE,MATUTINA,DIARIO(REGULAR),ALTA VERAPAZ
16-13-0145-43,16-025,ALTA VERAPAZ,CHISEC,EORM COMUNIDAD NACIMIENTO RUBELSANTO,COMUNIDAD NACIMIENTO RUBELSALTO,,CARLOS ARMANDO PAAÚ TZÍ,JOSÉ ROGELIO OCH SUCUP,PRIMARIA,OFICIAL,RURAL,ABIERTA,BILINGUE,MATUTINA,DIARIO(REGULAR),ALTA VERAPAZ
16-13-0146-43,16-025,ALTA VERAPAZ,CHISEC,EORM COMUNIDAD SAN FRANCISCO LAS MERCEDES,COMUNIDAD SAN FRANCISCO LAS MERCEDES,,CARLOS ARMANDO PAAÚ TZÍ,ROSMERY ELIZABETH CUCUL CAL,PRIMARIA,OFICIAL,RURAL,ABIERTA,BILINGUE,MATUTINA,DIARIO(REGULAR),ALTA VERAPAZ
16-13-0147-43,16-025,ALTA VERAPAZ,CHISEC,EORM,COMUNIDAD LA ISLA DEL REMOLINO,50050200,CARLOS ARMANDO PAAÚ TZÍ,CLAUDIA YANETH RAYMUNDO CHIROY,PRIMARIA,OFICIAL,RURAL,ABIERTA,BILINGUE,MATUTINA,DIARIO(REGULAR),ALTA VERAPAZ
16-13-0151-43,16-025,ALTA VERAPAZ,CHISEC,EORM COMUNIDAD TIERRA LINDA SECTOR III,COMUNIDAD TIERRA LINDA SECTOR III,45042276,CARLOS ARMANDO PAAÚ TZÍ,CARLOS MO LEM,PRIMARIA,OFICIAL,RURAL,ABIERTA,BILINGUE,MATUTINA,DIARIO(REGULAR),ALTA VERAPAZ
16-13-0152-43,16-025,ALTA VERAPAZ,CHISEC,EORM COMUNIDAD SANTA MARIA SETZUUL,COMUNIDAD SANTA MARIA SETZUUL,,CARLOS ARMANDO PAAÚ TZÍ,ELIAS POOU CHE,PRIMARIA,OFICIAL,RURAL,ABIERTA,BILINGUE,MATUTINA,DIARIO(REGULAR),ALTA VERAPAZ
16-13-0153-43,16-045,ALTA VERAPAZ,CHISEC,EORM CASERÍO LA BENDICIÓN I,CASERIO LA BENDICION I,40419309,ALFONSO BOTZOC CAN,ARMANDO ALVARO CHE CAÁL,PRIMARIA,OFICIAL,RURAL,ABIERTA,BILINGUE,MATUTINA,DIARIO(REGULAR),ALTA VERAPAZ
16-13-0155-43,16-024,ALTA VERAPAZ,CHISEC,EOUM,COLONIA LOS ANGELES,,CESAR ROLANDO CHOCOOJ YALIBAT,CESAR MARTÍN TOX XÓ,PRIMARIA,OFICIAL,RURAL,ABIERTA,MONOLINGUE,MATUTINA,DIARIO(REGULAR),ALTA VERAPAZ
16-13-0160-43,16-025,ALTA VERAPAZ,CHISEC,EORM,CASERIO LIMON IMPERIAL,57411219,CARLOS ARMANDO PAAÚ TZÍ,ALBERTO POP BOTZOC,PRIMARIA,OFICIAL,RURAL,ABIERTA,BILINGUE,MATUTINA,DIARIO(REGULAR),ALTA VERAPAZ
16-13-0183-43,16-025,ALTA VERAPAZ,CHISEC,EORM,COMUNIDAD PRESBITERIANA BETHANIA,46388848,CARLOS ARMANDO PAAÚ TZÍ,ERICK FERNANDO CHOC CHÉN,PRIMARIA,OFICIAL,RURAL,ABIERTA,BILINGUE,MATUTINA,DIARIO(REGULAR),ALTA VERAPAZ
16-13-0184-43,16-024,ALTA VERAPAZ,CHISEC,EOUM,COLONIA LA ESPERANZA,40071284,CESAR ROLANDO CHOCOOJ YALIBAT,PABLO CHOC YAXCAL,PRIMARIA,OFICIAL,URBANA,ABIERTA,MONOLINGUE,MATUTINA,DIARIO(REGULAR),ALTA VERAPAZ
16-13-0185-43,16-024,ALTA VERAPAZ,CHISEC,EORM,CASERIO EL PORVENIR,40375370,CESAR ROLANDO CHOCOOJ YALIBAT,FRANCISCO CAAL CUCUL,PRIMARIA,OFICIAL,RURAL,ABIERTA,BILINGUE,MATUTINA,DIARIO(REGULAR),ALTA VERAPAZ
16-13-0186-43,16-025,ALTA VERAPAZ,CHISEC,EORM,ALDEA NUEVA TIERRA,32918157,CARLOS ARMANDO PAAÚ TZÍ,AMALIA CONCEPCIÓN HIDALGO CHO,PRIMARIA,OFICIAL,RURAL,ABIERTA,BILINGUE,MATUTINA,DIARIO(REGULAR),ALTA VERAPAZ
16-13-0187-43,16-024,ALTA VERAPAZ,CHISEC,EORM,SECHINAPEMECH,40184120,CESAR ROLANDO CHOCOOJ YALIBAT,RAFAEL ESTUARDO PAREDES HERNANDEZ,PRIMARIA,OFICIAL,RURAL,ABIERTA,BILINGUE,MATUTINA,DIARIO(REGULAR),ALTA VERAPAZ
16-13-0188-43,16-024,ALTA VERAPAZ,CHISEC,EOUM,BARRIO SAN PABLO,49780393,CESAR ROLANDO CHOCOOJ YALIBAT,ANGEL GABRIEL YATZ ICAL,PRIMARIA,OFICIAL,URBANA,ABIERTA,MONOLINGUE,MATUTINA,DIARIO(REGULAR),ALTA VERAPAZ
16-13-0189-43,16-024,ALTA VERAPAZ,CHISEC,EORM,CASERIO CHAQUIPUR,57558918,CESAR ROLANDO CHOCOOJ YALIBAT,JOSUE OTONIEL CAAL PAAU,PRIMARIA,OFICIAL,RURAL,ABIERTA,BILINGUE,MATUTINA,DIARIO(REGULAR),ALTA VERAPAZ
16-13-0190-43,16-024,ALTA VERAPAZ,CHISEC,EORM,CASERIO EL PARAISO II,,CESAR ROLANDO CHOCOOJ YALIBAT,RAMIRO CAC BA,PRIMARIA,OFICIAL,RURAL,ABIERTA,BILINGUE,MATUTINA,DIARIO(REGULAR),ALTA VERAPAZ
16-13-0203-43,16-025,ALTA VERAPAZ,CHISEC,EORM,CASERIO SERRANIA LOS MAYAS,,CARLOS ARMANDO PAAÚ TZÍ,CÉSAR LEONEL PAAU RAX,PRIMARIA,OFICIAL,RURAL,ABIERTA,BILINGUE,MATUTINA,DIARIO(REGULAR),ALTA VERAPAZ
16-13-0204-43,16-024,ALTA VERAPAZ,CHISEC,EORM,CASERIO NUEVO EDEN,33094585,CESAR ROLANDO CHOCOOJ YALIBAT,RONAL MIGUEL HERNÁNDEZ GARCÍA,PRIMARIA,OFICIAL,RURAL,ABIERTA,BILINGUE,MATUTINA,DIARIO(REGULAR),ALTA VERAPAZ
16-13-0207-43,16-024,ALTA VERAPAZ,CHISEC,EOUM,BARRIO SECTOR SUR,39055829,CESAR ROLANDO CHOCOOJ YALIBAT,ROLANDO CAAL QUIB,PRIMARIA,OFICIAL,URBANA,ABIERTA,MONOLINGUE,MATUTINA,DIARIO(REGULAR),ALTA VERAPAZ
16-13-0209-43,16-024,ALTA VERAPAZ,CHISEC,EOUM,COLONIA PAZ Y DESARROLLO,58985584,CESAR ROLANDO CHOCOOJ YALIBAT,MIGUEL ANGEL CAAL MAX,PRIMARIA,OFICIAL,URBANA,ABIERTA,MONOLINGUE,MATUTINA,DIARIO(REGULAR),ALTA VERAPAZ
16-13-0210-43,16-045,ALTA VERAPAZ,CHISEC,EORM,CASERIO SIGUANHA,,ALFONSO BOTZOC CAN,HUMBERTO GONZALO COC YOJ,PRIMARIA,OFICIAL,RURAL,ABIERTA,BILINGUE,MATUTINA,DIARIO(REGULAR),ALTA VERAPAZ
16-13-0211-43,16-045,ALTA VERAPAZ,CHISEC,EORM,CASERIO LAGUNA FLOR DEL NORTE,30597911,ALFONSO BOTZOC CAN,HERMINIA TZALAM CHOC,PRIMARIA,OFICIAL,RURAL,ABIERTA,BILINGUE,MATUTINA,DIARIO(REGULAR),ALTA VERAPAZ
16-13-0219-43,16-025,ALTA VERAPAZ,CHISEC,EORM,CASERIO SAN ANTONIO EL ARENAL,53701683,CARLOS ARMANDO PAAÚ TZÍ,JAIME GABRIEL PAÁU MAQUIN,PRIMARIA,OFICIAL,RURAL,ABIERTA,BILINGUE,MATUTINA,DIARIO(REGULAR),ALTA VERAPAZ
16-13-0236-43,16-024,ALTA VERAPAZ,CHISEC,EOUM,BARRIO MONJA BLANCA,45407257,CESAR ROLANDO CHOCOOJ YALIBAT,THELMA TOT TIUL,PRIMARIA,OFICIAL,RURAL,ABIERTA,MONOLINGUE,MATUTINA,DIARIO(REGULAR),ALTA VERAPAZ
16-13-0237-43,16-024,ALTA VERAPAZ,CHISEC,EORM,CASERÍO VALLE VERDE,40589594,CESAR ROLANDO CHOCOOJ YALIBAT,HECTOR LEONEL JOR POP,PRIMARIA,OFICIAL,RURAL,ABIERTA,MONOLINGUE,MATUTINA,DIARIO(REGULAR),ALTA VERAPAZ
16-13-0239-43,16-045,ALTA VERAPAZ,CHISEC,EORM,CASERIO SEMOX YALIPUR,79510080,ALFONSO BOTZOC CAN,ROLANDO MAQUIN COC,PRIMARIA,OFICIAL,RURAL,ABIERTA,BILINGUE,MATUTINA,DIARIO(REGULAR),ALTA VERAPAZ
16-13-0242-43,16-025,ALTA VERAPAZ,CHISEC,EORM,ALDEA ISLA DEL NORTE,45476452,CARLOS ARMANDO PAAÚ TZÍ,CARMEN RAMOS SOLÍS,PRIMARIA,OFICIAL,RURAL,ABIERTA,BILINGUE,MATUTINA,DIARIO(REGULAR),ALTA VERAPAZ
16-13-0243-43,16-024,ALTA VERAPAZ,CHISEC,EORM,CASERÍO MALAGUETA,79511009,CESAR ROLANDO CHOCOOJ YALIBAT,TOMAS ICO BOTZOC,PRIMARIA,OFICIAL,RURAL,ABIERTA,BILINGUE,MATUTINA,DIARIO(REGULAR),ALTA VERAPAZ
16-13-0244-43,16-024,ALTA VERAPAZ,CHISEC,EORM,CASERÍO MONTE HERMON,79510090,CESAR ROLANDO CHOCOOJ YALIBAT,HERMELINDO ASIG AX,PRIMARIA,OFICIAL,RURAL,ABIERTA,BILINGUE,MATUTINA,DIARIO(REGULAR),ALTA VERAPAZ
16-13-0245-43,16-025,ALTA VERAPAZ,CHISEC,EORM,CASERÍO GETZEMANI,32968437,CARLOS ARMANDO PAAÚ TZÍ,EMANUEL TELETOR CHÉN,PRIMARIA,OFICIAL,RURAL,ABIERTA,BILINGUE,MATUTINA,DIARIO(REGULAR),ALTA VERAPAZ
16-13-0246-43,16-024,ALTA VERAPAZ,CHISEC,EOUM,BARRIO BELLA VISTA,48829033,CESAR ROLANDO CHOCOOJ YALIBAT,MARIA NOHELIA ALVAREZ REYES,PRIMARIA,OFICIAL,URBANA,ABIERTA,BILINGUE,MATUTINA,DIARIO(REGULAR),ALTA VERAPAZ
16-13-0248-43,16-045,ALTA VERAPAZ,CHISEC,EORM,CASERIO CHINASAJAL CHIBUT,79510080,ALFONSO BOTZOC CAN,ALBERTO CAAL CUCUL,PRIMARIA,OFICIAL,RURAL,ABIERTA,BILINGUE,MATUTINA,DIARIO(REGULAR),ALTA VERAPAZ
16-13-0253-43,16-025,ALTA VERAPAZ,CHISEC,EORM,CASERIO CERRO QUEMADO II,79510080,CARLOS ARMANDO PAAÚ TZÍ,CARLOS ENRIQUE COY COL,PRIMARIA,OFICIAL,RURAL,ABIERTA,BILINGUE,MATUTINA,DIARIO(REGULAR),ALTA VERAPAZ
16-13-0255-43,16-025,ALTA VERAPAZ,CHISEC,EORM,CASERIO LA CEIBA,30262619,CARLOS ARMANDO PAAÚ TZÍ,MATILDE CUCUL CAC,PRIMARIA,OFICIAL,RURAL,ABIERTA,BILINGUE,MATUTINA,DIARIO(REGULAR),ALTA VERAPAZ
16-13-0257-43,16-024,ALTA VERAPAZ,CHISEC,EORM,CASERÍO LAS VICTORIAS,57511707,CESAR ROLANDO CHOCOOJ YALIBAT,SILVIA GEDALIA CAAL MORÁN,PRIMARIA,OFICIAL,RURAL,ABIERTA,BILINGUE,MATUTINA,DIARIO(REGULAR),ALTA VERAPAZ
16-13-0258-43,16-024,ALTA VERAPAZ,CHISEC,EOUM,BARRIO EL JORDAN,53676218,CESAR ROLANDO CHOCOOJ YALIBAT,MARILYN MAGALÍ SENTE CAAL,PRIMARIA,OFICIAL,URBANA,ABIERTA,BILINGUE,MATUTINA,DIARIO(REGULAR),ALTA VERAPAZ
16-13-0260-43,16-024,ALTA VERAPAZ,CHISEC,EORM,CASERIO MONTE SION,30059271,CESAR ROLANDO CHOCOOJ YALIBAT,---,PRIMARIA,OFICIAL,RURAL,ABIERTA,BILINGUE,MATUTINA,DIARIO(REGULAR),ALTA VERAPAZ
16-13-0261-43,16-045,ALTA VERAPAZ,CHISEC,EORM,ALDEA CANDELARIA YALICAR,40644991,ALFONSO BOTZOC CAN,FRANCISCO CACAO MAQUÍM,PRIMARIA,OFICIAL,RURAL,ABIERTA,BILINGUE,MATUTINA,DIARIO(REGULAR),ALTA VERAPAZ
16-13-0269-43,16-045,ALTA VERAPAZ,CHISEC,EORM,CASERÍO DOLORES SEYAXUT CAJCAN,57357062,ALFONSO BOTZOC CAN,HECTOR SÌ CUC,PRIMARIA,OFICIAL,RURAL,ABIERTA,BILINGUE,MATUTINA,DIARIO(REGULAR),ALTA VERAPAZ
16-13-0271-43,16-024,ALTA VERAPAZ,CHISEC,COLEGIO CRISTIANO MIXTO PRIVADO EL NAZARENO,BARRIO EL CENTRO,57052581,CESAR ROLANDO CHOCOOJ YALIBAT,AXEL ALLAN CAAL CHOC,PRIMARIA,PRIVADO,URBANA,ABIERTA,MONOLINGUE,MATUTINA,DIARIO(REGULAR),ALTA VERAPAZ
16-13-0276-43,16-045,ALTA VERAPAZ,CHISEC,EORM,LOTIFICACIÓN VALLE VERDE,58066760,ALFONSO BOTZOC CAN,NERLLY ANAMIN CANTORAL,PRIMARIA,OFICIAL,RURAL,ABIERTA,BILINGUE,MATUTINA,DIARIO(REGULAR),ALTA VERAPAZ
16-13-0277-43,16-025,ALTA VERAPAZ,CHISEC,EORM,CASERIO LA GUACAMAYA,41767123,CARLOS ARMANDO PAAÚ TZÍ,GHERBERTH MAMERTO TOC MÓ,PRIMARIA,OFICIAL,RURAL,ABIERTA,BILINGUE,MATUTINA,DIARIO(REGULAR),ALTA VERAPAZ
16-13-0278-43,16-045,ALTA VERAPAZ,CHISEC,EORM,PARAJE RIO JORDAN,58066760,ALFONSO BOTZOC CAN,LESLY MAGALY OXÓM CHIQUÍN,PRIMARIA,OFICIAL,RURAL,ABIERTA,BILINGUE,MATUTINA,DIARIO(REGULAR),ALTA VERAPAZ
16-13-0963-43,16-045,ALTA VERAPAZ,CHISEC,EORM,CASERIO SEMAX,,ALFONSO BOTZOC CAN,OSCAR ENRIQUE ACTÉ CHOC,PRIMARIA,OFICIAL,RURAL,ABIERTA,BILINGUE,MATUTINA,DIARIO(REGULAR),ALTA VERAPAZ
16-13-0966-43,16-025,ALTA VERAPAZ,CHISEC,EORM,ALDEA MONTE CRISTO,49435670,CARLOS ARMANDO PAAÚ TZÍ,ERNESTO MAQUIN COC,PRIMARIA,OFICIAL,RURAL,ABIERTA,BILINGUE,MATUTINA,DIARIO(REGULAR),ALTA VERAPAZ
16-13-0968-43,16-025,ALTA VERAPAZ,CHISEC,EORM,ALDEA YALMACHAC,,CARLOS ARMANDO PAAÚ TZÍ,OSVALDO CAAL CHOC,PRIMARIA,OFICIAL,RURAL,ABIERTA,BILINGUE,MATUTINA,DIARIO(REGULAR),ALTA VERAPAZ
16-13-0969-43,16-025,ALTA VERAPAZ,CHISEC,EORM,ALDEA RUBELSANTO,46544483,CARLOS ARMANDO PAAÚ TZÍ,ALBERTO POOB YAT,PRIMARIA,OFICIAL,RURAL,ABIERTA,BILINGUE,MATUTINA,DIARIO(REGULAR),ALTA VERAPAZ
16-13-0971-43,16-024,ALTA VERAPAZ,CHISEC,EORM,ALDEA SEMUY,,CESAR ROLANDO CHOCOOJ YALIBAT,OLGA OLIVIA LEM LAJ,PRIMARIA,OFICIAL,RURAL,ABIERTA,BILINGUE,MATUTINA,DIARIO(REGULAR),ALTA VERAPAZ
16-13-0973-43,16-024,ALTA VERAPAZ,CHISEC,EOUM 30 DE JUNIO,BARRIO EL CENTRO,50613053,CESAR ROLANDO CHOCOOJ YALIBAT,NEYBY ONEIDA VILLATORO LÓPEZ,PRIMARIA,OFICIAL,URBANA,ABIERTA,MONOLINGUE,MATUTINA,DIARIO(REGULAR),ALTA VERAPAZ
