CODIGO,DISTRITO,DEPARTAMENTO,MUNICIPIO,ESTABLECIMIENTO,DIRECCION,TELEFONO,SUPERVISOR,DIRECTOR,NIVEL,SECTOR,AREA,STATUS,MODALIDAD,JORNADA,PLAN,DEPARTAMENTAL
17-01-0005-43,17-001,PETEN,FLORES,"EOUM ""J MIGUEL CASTELLANOS PACHECO""",PETEN,78775308,RODOLFO MEDINA,JUAN CARLOS GONZÁLEZ VÁSQUEZ,PRIMARIA,OFICIAL,URBANA,ABIERTA,MONOLINGUE,MATUTINA,DIARIO(REGULAR),PETÉN
17-01-0006-43,17-001,PETEN,FLORES,"EOUM JM, TIPO FEDERACION ""JOSE BENITEZ GOMEZ""",ALDEA SANTA ELENA DE LA CRUZ,79262390,RODOLFO MEDINA,ALICIA BEATRIZ GONGORA INECO,PRIMARIA,OFICIAL,URBANA,ABIERTA,MONOLINGUE,MATUTINA,DIARIO(REGULAR),PETÉN
17-01-0008-43,17-001,PETEN,FLORES,EORM PROFESOR JUAN CONCEPCION ARELLANO MARIN,ALDEA PAXCAMAN,42190960,RODOLFO MEDINA,ELVIRA ARGENTINA PAZ TUN,PRIMARIA,OFICIAL,RURAL,ABIERTA,MONOLINGUE,MATUTINA,DIARIO(REGULAR),PETÉN
17-01-0009-43,17-001,PETEN,FLORES,EORM,ALDEA EL NARANJO,,RODOLFO MEDINA,ROSA PATRICIA GALDAMEZ ROSADO,PRIMARIA,OFICIAL,RURAL,ABIERTA,MONOLINGUE,MATUTINA,DIARIO(REGULAR),PETÉN
17-01-0010-43,17-001,PETEN,FLORES,EORM 'CESARIO CETINA',ALDEA SAN MIGUEL,54821637,RODOLFO MEDINA,MÉLIDA FLORIDALMA ALVAREZ CÓRDOVA,PRIMARIA,OFICIAL,RURAL,ABIERTA,MONOLINGUE,MATUTINA,DIARIO(REGULAR),PETÉN
17-01-0011-43,17-001,PETEN,FLORES,EORM,CASERIO ALTAMIRA,58008391,RODOLFO MEDINA,HERBERT ROCAEL LEAL CHAN,PRIMARIA,OFICIAL,RURAL,ABIERTA,MONOLINGUE,MATUTINA,DIARIO(REGULAR),PETÉN
17-01-0012-43,17-001,PETEN,FLORES,EORM,ALDEA SOCOTZAL,47231797,RODOLFO MEDINA,ESDRAS ABDIAS BATÚN SANDOVAL,PRIMARIA,OFICIAL,RURAL,ABIERTA,MONOLINGUE,MATUTINA,DIARIO(REGULAR),PETÉN
17-01-0013-43,17-001,PETEN,FLORES,EOUM MARTA ROSA MORALES CETINA,ALDEA SANTA ELENA,42809952,RODOLFO MEDINA,MERCEDES ORTÍZ ÁVALOS,PRIMARIA,OFICIAL,URBANA,ABIERTA,MONOLINGUE,MATUTINA,DIARIO(REGULAR),PETÉN
17-01-0014-43,17-001,PETEN,FLORES,EORM,ALDEA EL ZAPOTE,46963915,RODOLFO MEDINA,ALVA LUZ IZAGUIRRE CHÁVEZ,PRIMARIA,OFICIAL,RURAL,ABIERTA,MONOLINGUE,MATUTINA,DIARIO(REGULAR),PETÉN
17-01-0015-43,17-001,PETEN,FLORES,EORM,ALDEA EL REMATE,,RODOLFO MEDINA,ANGELA SUSANA GÓMEZ HERRERA,PRIMARIA,OFICIAL,RURAL,ABIERTA,MONOLINGUE,MATUTINA,DIARIO(REGULAR),PETÉN
17-01-0016-43,17-001,PETEN,FLORES,EORM,ALDEA UAXACTUN,53119938,RODOLFO MEDINA,SANTIAGO AX CHOC,PRIMARIA,OFICIAL,RURAL,ABIERTA,MONOLINGUE,MATUTINA,DIARIO(REGULAR),PETÉN
17-01-0017-43,17-001,PETEN,FLORES,EORM,ALDEA MACANCHE,42471084,RODOLFO MEDINA,ARABELLA ANASTACIA RAMOS CASTILLO,PRIMARIA,OFICIAL,RURAL,ABIERTA,MONOLINGUE,MATUTINA,DIARIO(REGULAR),PETÉN
17-01-0018-43,17-001,PETEN,FLORES,EORM,CASERIO LOS TULIPANES,,RODOLFO MEDINA,EMIGDIO RAMON ZETINA CANEK,PRIMARIA,OFICIAL,RURAL,ABIERTA,MONOLINGUE,MATUTINA,DIARIO(REGULAR),PETÉN
17-01-0019-43,17-001,PETEN,FLORES,EORM,CASERIO LAS VIÑAS,,RODOLFO MEDINA,DIANA CHRISTIAN CRUZ CHOC,PRIMARIA,OFICIAL,RURAL,ABIERTA,MONOLINGUE,MATUTINA,DIARIO(REGULAR),PETÉN
17-01-0020-43,17-001,PETEN,FLORES,"EORM ""PROFESOR LUIS ALBERTO CASTELLANOS CORZO""",ALDEA EL CAOBA,49968268,RODOLFO MEDINA,JORGE SAÚL RODRÍGUEZ BONILLA,PRIMARIA,OFICIAL,RURAL,ABIERTA,MONOLINGUE,MATUTINA,DIARIO(REGULAR),PETÉN
17-01-0022-43,17-001,PETEN,FLORES,EORM,CASERIO EL CAPULINAR,42122294,RODOLFO MEDINA,VOANERGER FULGENCIO PORTILLO VEGA,PRIMARIA,OFICIAL,RURAL,ABIERTA,MONOLINGUE,MATUTINA,DIARIO(REGULAR),PETÉN
17-01-0024-43,17-001,PETEN,FLORES,EORM ANEXA A EORM,CASERIO IXLU,54828698,RODOLFO MEDINA,ORALIDA AMARILIS PORTILLO CAMPOS,PRIMARIA,OFICIAL,RURAL,ABIERTA,MONOLINGUE,MATUTINA,DIARIO(REGULAR),PETÉN
17-01-0026-43,17-001,PETEN,FLORES,EORM,CASERIO YAXHA,,RODOLFO MEDINA,SERGIO WALBERTO CASTELLANOS PANTÍ,PRIMARIA,OFICIAL,RURAL,ABIERTA,MONOLINGUE,MATUTINA,DIARIO(REGULAR),PETÉN
17-01-0027-43,17-001,PETEN,FLORES,EORM,ALDEA SANTA ELENA,,RODOLFO MEDINA,CESAR FRANCISCO SOZA MENDOZA,PRIMARIA,OFICIAL,RURAL,ABIERTA,MONOLINGUE,VESPERTINA,DIARIO(REGULAR),PETÉN
17-01-0029-43,17-001,PETEN,FLORES,EORM,CASERIO EL PORVENIR,32462432,RODOLFO MEDINA,LESBIA MARCENY BEDOYA PAREDES,PRIMARIA,OFICIAL,RURAL,ABIERTA,MONOLINGUE,MATUTINA,DIARIO(REGULAR),PETÉN
17-01-0030-43,17-001,PETEN,FLORES,EORM,"13 AVE. 2-47 ZONA 2, TERCERA LOTIFICACION, SANTA ELENA",58577117,RODOLFO MEDINA,JORGE OTTONIEL CASTELLANOS MORALES,PRIMARIA,OFICIAL,RURAL,ABIERTA,MONOLINGUE,MATUTINA,DIARIO(REGULAR),PETÉN
17-01-0031-43,17-001,PETEN,FLORES,EORM,CASERIO LA MAQUINA,,RODOLFO MEDINA,PEDRO LUIS CASTELLANOS OCHAETA,PRIMARIA,OFICIAL,RURAL,ABIERTA,MONOLINGUE,MATUTINA,DIARIO(REGULAR),PETÉN
17-01-0032-43,17-001,PETEN,FLORES,CPUM SANTA ELENA DE LA CRUZ,ALDEA SANTA ELENA,79248285,RODOLFO MEDINA,JESUS ELEODORO MENDEZ CASTELLANOS,PRIMARIA,PRIVADO,URBANA,ABIERTA,MONOLINGUE,VESPERTINA,DIARIO(REGULAR),PETÉN
17-01-0045-43,17-001,PETEN,FLORES,EORM,CASERIO EL LIMON,32390467,RODOLFO MEDINA,JESÚS MAQUÍN CHOC,PRIMARIA,OFICIAL,RURAL,ABIERTA,BILINGUE,MATUTINA,DIARIO(REGULAR),PETÉN
17-01-0046-43,17-001,PETEN,FLORES,EORM,BARRIO SEGUNDA LOTIFICACION,51933438,RODOLFO MEDINA,LORENA NINETH CHÁN MAS,PRIMARIA,OFICIAL,RURAL,ABIERTA,MONOLINGUE,MATUTINA,DIARIO(REGULAR),PETÉN
17-01-0047-43,17-001,PETEN,FLORES,EORM,CASERIO EL ARROZAL,41202352,RODOLFO MEDINA,GERMAN FERNANDO PAREDES SIS,PRIMARIA,OFICIAL,RURAL,ABIERTA,MONOLINGUE,MATUTINA,DIARIO(REGULAR),PETÉN
17-01-0048-43,17-001,PETEN,FLORES,EORM,"COLONIA MORALES, SANTA ELENA DE LA CRUZ",30442002,RODOLFO MEDINA,TELMA LETICIA CUPUL ARGUETA,PRIMARIA,OFICIAL,RURAL,ABIERTA,MONOLINGUE,MATUTINA,DIARIO(REGULAR),PETÉN
17-01-0049-43,17-001,PETEN,FLORES,EORM,CASERIO AGUADAS NUEVAS,,RODOLFO MEDINA,ERWIN OMAR OBANDO MOLINA,PRIMARIA,OFICIAL,RURAL,ABIERTA,MONOLINGUE,MATUTINA,DIARIO(REGULAR),PETÉN
17-01-0050-43,17-001,PETEN,FLORES,EORM,BARRIO LA GRANJA,51854859,RODOLFO MEDINA,ELSA MARINA SARCEÑO MARTINEZ,PRIMARIA,OFICIAL,RURAL,ABIERTA,MONOLINGUE,MATUTINA,DIARIO(REGULAR),PETÉN
17-01-0051-43,17-001,PETEN,FLORES,EORM,COMUNIDAD REACENTAMIENTO EL RAMONAL II,49647353,RODOLFO MEDINA,JESUS ELIOENAI GALIEGO KILKAN,PRIMARIA,OFICIAL,RURAL,ABIERTA,MONOLINGUE,MATUTINA,DIARIO(REGULAR),PETÉN
17-01-0052-43,17-001,PETEN,FLORES,EORM,CASERIO PASO DEL NORTE SANTA ELENA,,RODOLFO MEDINA,ANA ROSA GUERRA RAMOS,PRIMARIA,OFICIAL,RURAL,ABIERTA,MONOLINGUE,MATUTINA,DIARIO(REGULAR),PETÉN
17-01-0054-43,17-001,PETEN,FLORES,EORM,BARRIO BUENA VISTA COMUNIDAD EL NARANJO,49930116,RODOLFO MEDINA,ALBA LINDA MORALES OLIVARES,PRIMARIA,OFICIAL,RURAL,ABIERTA,MONOLINGUE,MATUTINA,DIARIO(REGULAR),PETÉN
17-01-0060-43,17-001,PETEN,FLORES,CENTRO DE EDUCACION ESPECIAL,ALDEA SANTA ELENA,59547212,RODOLFO MEDINA,KARLA MARIA CANEK CASTELLANOS,PRIMARIA,OFICIAL,RURAL,ABIERTA,MONOLINGUE,MATUTINA,DIARIO(REGULAR),PETÉN
17-01-0087-43,17-001,PETEN,FLORES,EORM DE EDUCACION ESPECIAL SEMILLITAS DE ESPERANZA,"4A. AVENIDA Y 6A. CALLE ZONA 2, SANTA ELENA DE LA CRUZ",47125572,RODOLFO MEDINA,NATALY VIVIANA RIVAS,PRIMARIA,OFICIAL,RURAL,ABIERTA,MONOLINGUE,MATUTINA,DIARIO(REGULAR),PETÉN
17-01-0090-43,17-001,PETEN,FLORES,COLEGIO CRISTIANO EL-HASHAMAYIM,"7A. AVENIDA 1-65 ZONA 2, SANTA ELENA DE LA CRUZ",79261812,RODOLFO MEDINA,JASMIN YOMALI VALDEZ ROSALES,PRIMARIA,PRIVADO,URBANA,ABIERTA,MONOLINGUE,MATUTINA,DIARIO(REGULAR),PETÉN
17-01-0102-43,17-001,PETEN,FLORES,EORM,COLONIA NUEVA SANTA ELENA,54608840,RODOLFO MEDINA,SHEILA YUMARA RIVAS YAT,PRIMARIA,OFICIAL,RURAL,ABIERTA,MONOLINGUE,MATUTINA,DIARIO(REGULAR),PETÉN
17-01-0107-43,17-001,PETEN,FLORES,EORM,CASERÍO EL TRIUNFO DE LA ESPERANZA,59057048,RODOLFO MEDINA,JUANA ESMERALDA GUERRA RAMOS,PRIMARIA,OFICIAL,RURAL,ABIERTA,MONOLINGUE,MATUTINA,DIARIO(REGULAR),PETÉN
17-01-0112-43,17-001,PETEN,FLORES,"""CENTRO EDUCATIVO INTEGRAL -CEI-""","2A. AVENIDA B, ZONA 2, PRIMERA LOTIFICACION, SANTA ELENA DE LA CRUZ",79261634,RODOLFO MEDINA,SONIA MARIELA MÉNDEZ MÉRIDA,PRIMARIA,PRIVADO,URBANA,ABIERTA,MONOLINGUE,MATUTINA,DIARIO(REGULAR),PETÉN
17-01-0118-43,17-001,PETEN,FLORES,LICEO JUAN PABLO SEGUNDO,"2DA.CALLE 3-98-ZONA 1 SANTA ELENA, PETEN",79248107,RODOLFO MEDINA,MARCO VINICIO TESUCUN BURGOS,PRIMARIA,PRIVADO,URBANA,ABIERTA,MONOLINGUE,MATUTINA,DIARIO(REGULAR),PETÉN
17-01-0121-43,17-001,PETEN,FLORES,"COLEGIO PRIVADO MIXTO ""SENDERO SHAIEL""",ALDEA PAXCAMAN,58503805,RODOLFO MEDINA,NEYDI MARISOL CAMBRANES BURGOS,PRIMARIA,PRIVADO,RURAL,ABIERTA,MONOLINGUE,VESPERTINA,DIARIO(REGULAR),PETÉN
17-01-0135-43,17-001,PETEN,FLORES,INSTITUTO COMERCIAL VILLA CONCEPCIÓN,1RA. AV. 2DA CALLE ZONA 2 SANTA ELENA,79248180,RODOLFO MEDINA,ASTRID SKARLETH SANTIZO TZAPIN,PRIMARIA,PRIVADO,URBANA,ABIERTA,MONOLINGUE,MATUTINA,DIARIO(REGULAR),PETÉN
17-01-0144-43,17-001,PETEN,FLORES,KINDERGARTEN MONTESSORI,1RA AV.B-65ZONA 2 BARRIO VILLA CONCEPCION,30224989,RODOLFO MEDINA,BEVERLY DAYIANA PINELO RODRIGUEZ,PRIMARIA,PRIVADO,URBANA,ABIERTA,MONOLINGUE,MATUTINA,DIARIO(REGULAR),PETÉN
17-01-0146-43,17-001,PETEN,FLORES,COLELEGIO CRISTIANO CON ORIENTACIÓN UNIVERSITARIA EL SHADDAI,"8VA. AV. 3-14-ANTIGUA POBLACION 2, SANTA ELENA DE LA CRUZ",59393916,RODOLFO MEDINA,RAUL ENRIQUE NUÑEZ IBAÑEZ,PRIMARIA,PRIVADO,URBANA,ABIERTA,MONOLINGUE,MATUTINA,DIARIO(REGULAR),PETÉN
17-01-0148-43,17-001,PETEN,FLORES,EORM,"COLONIA VALLE DEL SOL FLORES, PETÉN",48435619,RODOLFO MEDINA,YESENIA MARÍA XONÁ LÓPEZ,PRIMARIA,OFICIAL,RURAL,ABIERTA,MONOLINGUE,MATUTINA,DIARIO(REGULAR),PETÉN
17-01-0150-43,17-001,PETEN,FLORES,EORM,ALDEA PAXCAMAN,55157482,RODOLFO MEDINA,KEVIN ROCAEL ALVAREZ JIMENEZ,PRIMARIA,OFICIAL,RURAL,ABIERTA,MONOLINGUE,MATUTINA,DIARIO(REGULAR),PETÉN
17-01-0152-43,17-001,PETEN,FLORES,INSTITUTO MIXTO DE EDUCACION FUNDAMENTAL IMEF.,4TA.AV.Y 3RA CALLE ZONA 2 SANTA ELENA,31935982,RODOLFO MEDINA,ARNOLD ESTUARDO BIN TENÍ,PRIMARIA,PRIVADO,URBANA,ABIERTA,MONOLINGUE,MATUTINA,DIARIO(REGULAR),PETÉN
17-01-1166-43,17-001,PETEN,FLORES,CENTRO EDUCATIVO PETEN C.E.P.,SANTA ELENA DE LA CRUZ,25063600,RODOLFO MEDINA,DEVANY FAJIMA CHÁN PINELO,PRIMARIA,PRIVADO,URBANA,ABIERTA,MONOLINGUE,MATUTINA,DIARIO(REGULAR),PETÉN
17-01-1202-43,17-001,PETEN,FLORES,EOUM TIPO FEDERACION JOSE BENITEZ GOMEZ,SANTA ELENA DE LA CRUZ,59669587,RODOLFO MEDINA,MARÍA DEL PILAR ZETINA ALDANA,PRIMARIA,OFICIAL,URBANA,ABIERTA,MONOLINGUE,VESPERTINA,DIARIO(REGULAR),PETÉN
17-01-1210-43,17-001,PETEN,FLORES,EORM,TERCERA LOT. SANTA ELENA DE LA CRUZ BARRIO TZIQUINAJA,,RODOLFO MEDINA,BLANCA ROSA SANDOVAL,PRIMARIA,OFICIAL,RURAL,ABIERTA,MONOLINGUE,VESPERTINA,DIARIO(REGULAR),PETÉN
17-01-2432-43,17-001,PETEN,FLORES,LICEO MODERNO EN COMPUTACION,CALZADA RODRIGUEZ MACAL 6-40 ZONA 2 STA ELENA,79261015,RODOLFO MEDINA,NERY GÛILBERTO RALDA MALDONADO,PRIMARIA,PRIVADO,URBANA,ABIERTA,MONOLINGUE,VESPERTINA,DIARIO(REGULAR),PETÉN
17-01-3661-43,17-001,PETEN,FLORES,CENTRO EDUCATIVO NAZARENO,4A. CALLE A 5-55 ZONA 1 SANTA ELENA,79263311,RODOLFO MEDINA,VIVIAN MARICIELOS AQUINO SALAZAR,PRIMARIA,PRIVADO,RURAL,ABIERTA,MONOLINGUE,MATUTINA,DIARIO(REGULAR),PETÉN
17-01-3948-43,17-001,PETEN,FLORES,EORM,CASERIO TRES NACIONES,,RODOLFO MEDINA,KARLA LORENA CANEK CAMAL,PRIMARIA,OFICIAL,RURAL,ABIERTA,MONOLINGUE,MATUTINA,DIARIO(REGULAR),PETÉN
17-02-0007-43,17-002,PETEN,SAN JOSE,EORM,BARRIO NUEVA ESPERANZA CASERIO SAN PEDRO,46161044,LILIA SAUDITA SUNTECUN CHAN,ROMEO MARDOQUEO BURGOS MANZANERO,PRIMARIA,OFICIAL,RURAL,ABIERTA,MONOLINGUE,MATUTINA,DIARIO(REGULAR),PETÉN
17-02-0012-43,17-002,PETEN,SAN JOSE,EORM,BARRIO PORVENIR ZONA 3,57626281,LILIA SAUDITA SUNTECUN CHAN,ILDEGAR ANIBAL FIÓN AGUILAR,PRIMARIA,OFICIAL,RURAL,ABIERTA,MONOLINGUE,MATUTINA,DIARIO(REGULAR),PETÉN
17-02-0041-43,17-002,PETEN,SAN JOSE,EOUM 'CARLOS J. CAHUICHE',BARRIO EL PROGRESO,30653426,LILIA SAUDITA SUNTECUN CHAN,ASANET ANAITE COHUOJ COLLI,PRIMARIA,OFICIAL,URBANA,ABIERTA,MONOLINGUE,MATUTINA,DIARIO(REGULAR),PETÉN
17-02-0042-43,17-002,PETEN,SAN JOSE,EORM,ALDEA JOBOMPICHE,30808802,LILIA SAUDITA SUNTECUN CHAN,MARÍA MAGDALENA MATUS,PRIMARIA,OFICIAL,RURAL,ABIERTA,MONOLINGUE,MATUTINA,DIARIO(REGULAR),PETÉN
17-02-0043-43,17-002,PETEN,SAN JOSE,EORM,CASERIO SAN PEDRO,51680180,LILIA SAUDITA SUNTECUN CHAN,EDRAS OVIDIO RAMIREZ TORRES,PRIMARIA,OFICIAL,RURAL,ABIERTA,MONOLINGUE,MATUTINA,DIARIO(REGULAR),PETÉN
17-02-0044-43,17-002,PETEN,SAN JOSE,EORM,BARRIO NUEVO SAN JOSE,47897619,LILIA SAUDITA SUNTECUN CHAN,MELIXA YAMILETH CAHUICHE TESUCÚN,PRIMARIA,OFICIAL,RURAL,ABIERTA,MONOLINGUE,MATUTINA,DIARIO(REGULAR),PETÉN
17-02-0448-43,17-002,PETEN,SAN JOSE,EORM,CASERIO COROZAL,50502371,LILIA SAUDITA SUNTECUN CHAN,SEBASTIAN CHOC XOL,PRIMARIA,OFICIAL,RURAL,ABIERTA,BILINGUE,MATUTINA,DIARIO(REGULAR),PETÉN
17-02-1288-43,17-002,PETEN,SAN JOSE,EORM,BARRIO VISTA AL LAGO,30087442,LILIA SAUDITA SUNTECUN CHAN,CARMELINA ELIZABETH CHAN TESUCUN,PRIMARIA,OFICIAL,RURAL,ABIERTA,MONOLINGUE,MATUTINA,DIARIO(REGULAR),PETÉN
17-03-0004-43,17-003,PETEN,SAN BENITO,"CENTRO EDUCATIVO ""BETHANIA""","6A. CALLE, ZONA 4 BARRIO LA PAZ",42481288,DEYLIN ANTONIO ALVAREZ ALDANA,MELISSA AYDARÍ LÓPEZ ENRIQUEZ,PRIMARIA,PRIVADO,URBANA,ABIERTA,MONOLINGUE,MATUTINA,DIARIO(REGULAR),PETÉN
17-03-0013-43,17-003,PETEN,SAN BENITO,EORM,BARRIO LA PAZ,41504142,DEYLIN ANTONIO ALVAREZ ALDANA,HUSSEÍN ARIEL HOIL TZÍN,PRIMARIA,OFICIAL,RURAL,ABIERTA,MONOLINGUE,MATUTINA,DIARIO(REGULAR),PETÉN
17-03-0014-43,17-003,PETEN,SAN BENITO,EORM,BARRIO LAS FLORES,,DEYLIN ANTONIO ALVAREZ ALDANA,MYNOR LEONEL PINEDA PINEDA,PRIMARIA,OFICIAL,RURAL,ABIERTA,MONOLINGUE,MATUTINA,DIARIO(REGULAR),PETÉN
17-03-0015-43,17-003,PETEN,SAN BENITO,EORM,COLONIA VISTA HERMOSA,53264630,DEYLIN ANTONIO ALVAREZ ALDANA,ANGELICA HERNÁNDEZ SIS,PRIMARIA,OFICIAL,RURAL,ABIERTA,MONOLINGUE,MATUTINA,DIARIO(REGULAR),PETÉN
17-03-0016-43,17-003,PETEN,SAN BENITO,EORM,COLONIA 20 DE MAYO,79263844,DEYLIN ANTONIO ALVAREZ ALDANA,MANUEL ANTONIO ROMERO MUÑOZ,PRIMARIA,OFICIAL,RURAL,ABIERTA,MONOLINGUE,MATUTINA,DIARIO(REGULAR),PETÉN
17-03-0017-43,17-003,PETEN,SAN BENITO,EORM,BARRIO EL REDENTOR,41751984,DEYLIN ANTONIO ALVAREZ ALDANA,MYNOR ANTONIO COHUOJ COC,PRIMARIA,OFICIAL,RURAL,ABIERTA,MONOLINGUE,MATUTINA,DIARIO(REGULAR),PETÉN
17-03-0033-43,17-003,PETEN,SAN BENITO,EORM,BARRIO NUEVA ESPERANZA,30102511,DEYLIN ANTONIO ALVAREZ ALDANA,MARVIN JEOVANI GONZALEZ,PRIMARIA,OFICIAL,RURAL,ABIERTA,MONOLINGUE,MATUTINA,DIARIO(REGULAR),PETÉN
17-03-0037-43,17-003,PETEN,SAN BENITO,"CENTRO EDUCATIVO ""GRILLITO CANTOR""","1A. AVENIDA ""B"" 17-47, ZONA 1, BARRIO 3 DE ABRIL",79263506,DEYLIN ANTONIO ALVAREZ ALDANA,YOYSI WALKYRIA SOZA GUILLÉN,PRIMARIA,PRIVADO,URBANA,ABIERTA,MONOLINGUE,MATUTINA,DIARIO(REGULAR),PETÉN
17-03-0046-43,17-003,PETEN,SAN BENITO,EORM,BARRIO EL ARROYO,46013760,DEYLIN ANTONIO ALVAREZ ALDANA,ODILIA YANIRÉ PELÁEZ RODRIGUEZ,PRIMARIA,OFICIAL,RURAL,ABIERTA,MONOLINGUE,MATUTINA,DIARIO(REGULAR),PETÉN
17-03-0051-43,17-003,PETEN,SAN BENITO,EOUM 3 DE ABRIL PROF. GREGORIO ANGEL COCON ESCALERA,BARRIO 3 DE ABRIL,79260152,DEYLIN ANTONIO ALVAREZ ALDANA,MARÍA DE LOS ANGELES SANTIZO GABRIEL,PRIMARIA,OFICIAL,URBANA,ABIERTA,MONOLINGUE,VESPERTINA,DIARIO(REGULAR),PETÉN
17-03-0052-43,17-003,PETEN,SAN BENITO,EOUM 3 DE ABRIL PROFESOR GREGORIO ANGEL COCON ESCALERA,BARRIO 3 DE ABRIL,41062641,DEYLIN ANTONIO ALVAREZ ALDANA,RANDY WILFREDO PONCE CORADO,PRIMARIA,OFICIAL,URBANA,ABIERTA,MONOLINGUE,MATUTINA,DIARIO(REGULAR),PETÉN
17-03-0053-43,17-003,PETEN,SAN BENITO,EORM,ALDEA DE SAN ANTONIO,79264192,DEYLIN ANTONIO ALVAREZ ALDANA,JOSÉ BAUDILIO ZABALA GODINEZ,PRIMARIA,OFICIAL,RURAL,ABIERTA,MONOLINGUE,MATUTINA,DIARIO(REGULAR),PETÉN
17-03-0054-43,17-003,PETEN,SAN BENITO,"EORM ""PROFESOR BLAS DAVID BURELO SOZA""",BARRIO EL PEDREGAL,47784110,DEYLIN ANTONIO ALVAREZ ALDANA,GREISI YOHANA GONZALEZ GUZMAN,PRIMARIA,OFICIAL,RURAL,ABIERTA,MONOLINGUE,MATUTINA,DIARIO(REGULAR),PETÉN
17-03-0055-43,17-003,PETEN,SAN BENITO,EORM,ALDEA LA COBANERITA,55357427,DEYLIN ANTONIO ALVAREZ ALDANA,LUZMIN YAMILETH PIRIR AYALA,PRIMARIA,OFICIAL,RURAL,ABIERTA,BILINGUE,MATUTINA,DIARIO(REGULAR),PETÉN
17-03-0056-43,17-003,PETEN,SAN BENITO,EORM,COLONIA ITZATENANGO,36139268,DEYLIN ANTONIO ALVAREZ ALDANA,ESTHER EUNICE MAS MIS,PRIMARIA,OFICIAL,RURAL,ABIERTA,MONOLINGUE,MATUTINA,DIARIO(REGULAR),PETÉN
17-03-0057-43,17-003,PETEN,SAN BENITO,EORM,CASERIO BELEN,46794061,DEYLIN ANTONIO ALVAREZ ALDANA,CLAUDIA LUCRECIA ROSALES PECHE,PRIMARIA,OFICIAL,RURAL,ABIERTA,MONOLINGUE,MATUTINA,DIARIO(REGULAR),PETÉN
17-03-0058-43,17-003,PETEN,SAN BENITO,EORM,BARRIO EL PORVENIR,55140769,DEYLIN ANTONIO ALVAREZ ALDANA,ELIZABETH PANJOJ TELON,PRIMARIA,OFICIAL,RURAL,ABIERTA,MONOLINGUE,MATUTINA,DIARIO(REGULAR),PETÉN
17-03-0059-43,17-003,PETEN,SAN BENITO,EORM EL HABANERO,BARRIO TIKAL,33556479,DEYLIN ANTONIO ALVAREZ ALDANA,LETINA CANDELARIA CORTEZ CHAN,PRIMARIA,OFICIAL,RURAL,ABIERTA,MONOLINGUE,MATUTINA,DIARIO(REGULAR),PETÉN
17-03-0060-43,17-003,PETEN,SAN BENITO,EORM,BARRIO VALLE NUEVO,,DEYLIN ANTONIO ALVAREZ ALDANA,KENETH ZAMIRO LEONARDO HEREDIA,PRIMARIA,OFICIAL,RURAL,ABIERTA,MONOLINGUE,MATUTINA,DIARIO(REGULAR),PETÉN
17-03-0066-43,17-003,PETEN,SAN BENITO,EORM,BARRIO EL MILAGRO,,DEYLIN ANTONIO ALVAREZ ALDANA,GEINI JUDITH ROSALES SUÁREZ,PRIMARIA,OFICIAL,RURAL,ABIERTA,MONOLINGUE,MATUTINA,DIARIO(REGULAR),PETÉN
17-03-0070-43,17-003,PETEN,SAN BENITO,"LICEO CRISTIANO BILINGÜE ""JEHOVÁ JIREH""",BARRIO EL PORVENIR,79260220,DEYLIN ANTONIO ALVAREZ ALDANA,IVONNE ANITA ORTIZ MORÁN,PRIMARIA,PRIVADO,URBANA,ABIERTA,MONOLINGUE,MATUTINA,DIARIO(REGULAR),PETÉN
17-03-0075-43,17-003,PETEN,SAN BENITO,"CENTRO EDUCATIVO CRISTIANO CON ORIENTACIÓN UNIVERSITARIA ""EL SHADDAI""","5A. CALLE Y 2A. AVENIDA, BARRIO EL PORVENIR",79263476,DEYLIN ANTONIO ALVAREZ ALDANA,HUSWER LANDREWS SARCEÑO MARTINEZ,PRIMARIA,PRIVADO,URBANA,ABIERTA,MONOLINGUE,MATUTINA,DIARIO(REGULAR),PETÉN
17-03-0077-43,17-003,PETEN,SAN BENITO,"CENTRO EDUCATIVO CRISTIANO CON ORIENTACIÓN UNIVERSITARIA ""EL SHADDAI""","5A. CALLE Y 2A. AVENIDA, BARRIO EL PORVENIR",79263476,DEYLIN ANTONIO ALVAREZ ALDANA,ELSA MARINA SARCEÑO MARTINEZ,PRIMARIA,PRIVADO,URBANA,ABIERTA,MONOLINGUE,VESPERTINA,DIARIO(REGULAR),PETÉN
17-03-0081-43,17-003,PETEN,SAN BENITO,CENTRO EDUCATIVO PRIVADO MIXTO DE EDUCACION PRIMARIA-CEPMEP-,BARRIO TIKAL,55551904,DEYLIN ANTONIO ALVAREZ ALDANA,FREDY HENRY SUAREZ LÓPEZ,PRIMARIA,PRIVADO,URBANA,ABIERTA,MONOLINGUE,VESPERTINA,DIARIO(REGULAR),PETÉN
17-03-0092-43,17-003,PETEN,SAN BENITO,LICEO INTEGRAL NUEVA GENERACIÓN-LING-,BARRIO EL PEDREGAL,41821593,DEYLIN ANTONIO ALVAREZ ALDANA,MIGUEL ANGEL MEJIA FLORES,PRIMARIA,PRIVADO,URBANA,ABIERTA,MONOLINGUE,VESPERTINA,DIARIO(REGULAR),PETÉN
17-03-0106-43,17-003,PETEN,SAN BENITO,EORM,COLONIA JUAREZ,55357427,DEYLIN ANTONIO ALVAREZ ALDANA,NOEMI LÓPEZ ORELLANA,PRIMARIA,OFICIAL,RURAL,ABIERTA,BILINGUE,MATUTINA,DIARIO(REGULAR),PETÉN
17-03-0110-43,17-003,PETEN,SAN BENITO,PROYECTO EDUCATIVO TOCA,BARRIO CARIDAD,41240663,DEYLIN ANTONIO ALVAREZ ALDANA,AMELIA YESENIA ESCOBAR ALVARADO,PRIMARIA,PRIVADO,URBANA,ABIERTA,MONOLINGUE,VESPERTINA,DIARIO(REGULAR),PETÉN
17-03-0118-43,17-003,PETEN,SAN BENITO,EORM,CASERIO LA UNION,55320377,DEYLIN ANTONIO ALVAREZ ALDANA,ROGEL MAGUENDI CUNIL ICAL,PRIMARIA,OFICIAL,RURAL,ABIERTA,MONOLINGUE,MATUTINA,DIARIO(REGULAR),PETÉN
17-03-0138-43,17-003,PETEN,SAN BENITO,CENTRO EDUCATIVO EDUCARE,BARRIO EL PORVENIR,52006011,DEYLIN ANTONIO ALVAREZ ALDANA,MÓNICA DELFINA GONZÁLEZ GUZMÁN,PRIMARIA,PRIVADO,URBANA,ABIERTA,MONOLINGUE,MATUTINA,DIARIO(REGULAR),PETÉN
17-03-0449-43,17-003,PETEN,SAN BENITO,EORM,BARRIO VISTA HERMOSA,,DEYLIN ANTONIO ALVAREZ ALDANA,MIGUEL ANGEL DELGADO LÓPEZ,PRIMARIA,OFICIAL,RURAL,ABIERTA,MONOLINGUE,MATUTINA,DIARIO(REGULAR),PETÉN
17-03-1984-43,17-003,PETEN,SAN BENITO,EORM,BARRIO EL PORVENIR,,DEYLIN ANTONIO ALVAREZ ALDANA,SULMI VANESSA JORDÁN CARDONA,PRIMARIA,OFICIAL,RURAL,ABIERTA,MONOLINGUE,VESPERTINA,DIARIO(REGULAR),PETÉN
17-03-1987-43,17-003,PETEN,SAN BENITO,EORM PROFESOR BLAS DAVID BURELO SOZA,14A. AVENIDA ENTRE 2A. CALLE B Y 3A. CALLE ZONA 2 BARRIO EL PEDREGAL,,DEYLIN ANTONIO ALVAREZ ALDANA,ROSA CARLOTA FRANCO SALAS,PRIMARIA,OFICIAL,RURAL,ABIERTA,MONOLINGUE,VESPERTINA,DIARIO(REGULAR),PETÉN
17-03-2016-43,17-003,PETEN,SAN BENITO,EORM,BARRIO LA DEMOCRACIA,42150639,DEYLIN ANTONIO ALVAREZ ALDANA,CARLOS ENRIQUE OCHAETA CALDERON,PRIMARIA,OFICIAL,RURAL,ABIERTA,MONOLINGUE,MATUTINA,DIARIO(REGULAR),PETÉN
17-03-2112-43,17-003,PETEN,SAN BENITO,EORM PROFESOR ANTONIO ENRIQUE JUAREZ OBANDO,BARRIO SAN JUAN,44913438,DEYLIN ANTONIO ALVAREZ ALDANA,JOSUÉ FRANCISCO MORO SALAS,PRIMARIA,OFICIAL,RURAL,ABIERTA,MONOLINGUE,MATUTINA,DIARIO(REGULAR),PETÉN
17-03-2114-43,17-003,PETEN,SAN BENITO,"EORM ""PROFESORA MARIA DE LOURDES ACOSTA ALONZO""",BARRIO CARIDAD,56363776,DEYLIN ANTONIO ALVAREZ ALDANA,MARÍA DE LOURDES ACOSTA ALONZO,PRIMARIA,OFICIAL,RURAL,ABIERTA,MONOLINGUE,MATUTINA,DIARIO(REGULAR),PETÉN
17-03-2447-43,17-003,PETEN,SAN BENITO,COLEGIO ADVENTISTA DE PETEN,18 CALLE 1A. AV. ZONA 1,79263234,DEYLIN ANTONIO ALVAREZ ALDANA,EVELYN MARISOL HERNÁNDEZ COLLÍ,PRIMARIA,PRIVADO,URBANA,ABIERTA,MONOLINGUE,MATUTINA,DIARIO(REGULAR),PETÉN
17-03-2885-43,17-003,PETEN,SAN BENITO,EORM,BARRIO VISTA HERMOSA,30363673,DEYLIN ANTONIO ALVAREZ ALDANA,FILIBERTO FIDEL PÉREZ DE LEÓN,PRIMARIA,OFICIAL,RURAL,ABIERTA,MONOLINGUE,VESPERTINA,DIARIO(REGULAR),PETÉN
17-03-3438-43,17-003,PETEN,SAN BENITO,EORM,BARRIO LA CANDELARIA,55924599,DEYLIN ANTONIO ALVAREZ ALDANA,ERENDIDA BEATRIZ LÓPEZ MORALES,PRIMARIA,OFICIAL,RURAL,ABIERTA,MONOLINGUE,MATUTINA,DIARIO(REGULAR),PETÉN
17-03-3457-43,17-003,PETEN,SAN BENITO,EORM,BARRIO BELLOS HORIZONTES,42914642,DEYLIN ANTONIO ALVAREZ ALDANA,ABNER ABISAÍ GUTIÉRREZ GÓMEZ,PRIMARIA,OFICIAL,RURAL,ABIERTA,MONOLINGUE,MATUTINA,DIARIO(REGULAR),PETÉN
17-03-3505-43,17-003,PETEN,SAN BENITO,COLEGIO CRISTIANO BILINGÜE MANANTIAL,COLONIA TIKAL,55140702,DEYLIN ANTONIO ALVAREZ ALDANA,NANCY ADALY PRADO PÉREZ,PRIMARIA,PRIVADO,URBANA,ABIERTA,MONOLINGUE,MATUTINA,DIARIO(REGULAR),PETÉN
17-03-3829-43,17-003,PETEN,SAN BENITO,EORM,BARRIO PANORAMA II,42317428,DEYLIN ANTONIO ALVAREZ ALDANA,ALEX GEOBANY SUNTECÚN COLLÍ,PRIMARIA,OFICIAL,RURAL,ABIERTA,MONOLINGUE,MATUTINA,DIARIO(REGULAR),PETÉN
17-03-4169-43,17-003,PETEN,SAN BENITO,EORM,BARRIO VILLA HERMOSA,41881096,DEYLIN ANTONIO ALVAREZ ALDANA,LESBIA AZUCENA CANALES GUTIÉRREZ,PRIMARIA,OFICIAL,RURAL,ABIERTA,MONOLINGUE,MATUTINA,DIARIO(REGULAR),PETÉN
17-04-0003-43,17-005,PETEN,SAN ANDRES,EORM,CASERIO EL PACIFICO,,RICARDO ANTONIO GARCIA Y GARCIA,MANUEL ANTONIO SOZA BURGOS,PRIMARIA,OFICIAL,RURAL,ABIERTA,MONOLINGUE,MATUTINA,DIARIO(REGULAR),PETÉN
17-04-0004-43,17-005,PETEN,SAN ANDRES,EORM,CASERIO LA FISGA,,RICARDO ANTONIO GARCIA Y GARCIA,OSBEL EZEQUIEL ORREGO COHUOJ,PRIMARIA,OFICIAL,RURAL,ABIERTA,MONOLINGUE,MATUTINA,DIARIO(REGULAR),PETÉN
17-04-0005-43,17-005,PETEN,SAN ANDRES,EORM,CASERIO SEIS ISLAS,,RICARDO ANTONIO GARCIA Y GARCIA,ANGEL RONALDO VELÁSQUEZ ALDANA,PRIMARIA,OFICIAL,RURAL,ABIERTA,MONOLINGUE,MATUTINA,DIARIO(REGULAR),PETÉN
17-04-0006-43,17-005,PETEN,SAN ANDRES,EORM,CASERIO LAGUNA LARGA,46078404,RICARDO ANTONIO GARCIA Y GARCIA,WAGNER ADILSON CHÍ SINTURIÓN,PRIMARIA,OFICIAL,RURAL,ABIERTA,MONOLINGUE,MATUTINA,DIARIO(REGULAR),PETÉN
17-04-0007-43,17-005,PETEN,SAN ANDRES,EORM,CASERIO SAN JOSE LA CUMBRE,,RICARDO ANTONIO GARCIA Y GARCIA,KATHY ANGELITA CUITZ ZAC,PRIMARIA,OFICIAL,RURAL,ABIERTA,MONOLINGUE,MATUTINA,DIARIO(REGULAR),PETÉN
17-04-0022-43,17-002,PETEN,SAN ANDRES,EORM,"COROZAL, LA PASADITA",55357610,LILIA SAUDITA SUNTECUN CHAN,LUDWIN RENE PUGA QUIXCHAN,PRIMARIA,OFICIAL,RURAL,ABIERTA,MONOLINGUE,MATUTINA,DIARIO(REGULAR),PETÉN
17-04-0024-43,17-004,PETEN,SAN ANDRES,EORM,BARRIO EL PLANTEL SACPUY,47784487,CARLOS MANUEL TESUCUN QUETZAL,DONIS JOÉ PUGA CANO,PRIMARIA,OFICIAL,RURAL,ABIERTA,MONOLINGUE,MATUTINA,DIARIO(REGULAR),PETÉN
17-04-0025-43,17-004,PETEN,SAN ANDRES,EORM,CASERIO LA JUVENTUD,,CARLOS MANUEL TESUCUN QUETZAL,LESNY FAVIOLA CUNIL CHOC,PRIMARIA,OFICIAL,RURAL,ABIERTA,MONOLINGUE,MATUTINA,DIARIO(REGULAR),PETÉN
17-04-0026-43,17-005,PETEN,SAN ANDRES,EORM,CASERIO BELLA VISTA,,RICARDO ANTONIO GARCIA Y GARCIA,YAZMIN ANAYTÉ CHABLÉ TESUCÚN,PRIMARIA,OFICIAL,RURAL,ABIERTA,MONOLINGUE,MATUTINA,DIARIO(REGULAR),PETÉN
17-04-0027-43,17-005,PETEN,SAN ANDRES,EORM,CASERIO BUENOS AIRES FRONTERA,45953135,RICARDO ANTONIO GARCIA Y GARCIA,ELVIS AUDIEL CHÍ SINTURIÓN,PRIMARIA,OFICIAL,RURAL,ABIERTA,MONOLINGUE,MATUTINA,DIARIO(REGULAR),PETÉN
17-04-0028-43,17-005,PETEN,SAN ANDRES,EORM,CASERIO LOS REYES,,RICARDO ANTONIO GARCIA Y GARCIA,ALVARO IMERI COCÓN GARCÍA,PRIMARIA,OFICIAL,RURAL,ABIERTA,MONOLINGUE,MATUTINA,DIARIO(REGULAR),PETÉN
17-04-0029-43,17-005,PETEN,SAN ANDRES,EORM,CASERIO LOS TUBOS,46773491,RICARDO ANTONIO GARCIA Y GARCIA,BRENDA ELIZABETH CUNIL RODRIGUEZ,PRIMARIA,OFICIAL,RURAL,ABIERTA,MONOLINGUE,MATUTINA,DIARIO(REGULAR),PETÉN
17-04-0030-43,17-005,PETEN,SAN ANDRES,EORM,PARCELAMIENTO SUCELY SANTA AMELIA,,RICARDO ANTONIO GARCIA Y GARCIA,HARRISON EMMANUEL ACOSTA CHATÁ,PRIMARIA,OFICIAL,RURAL,ABIERTA,MONOLINGUE,MATUTINA,DIARIO(REGULAR),PETÉN
17-04-0032-43,17-005,PETEN,SAN ANDRES,EORM,CASERIO EL MIRADOR RIO CHOCOP,45062312,RICARDO ANTONIO GARCIA Y GARCIA,DORIAN ALEXANDER CUNIL ICAL,PRIMARIA,OFICIAL,RURAL,ABIERTA,MONOLINGUE,MATUTINA,DIARIO(REGULAR),PETÉN
17-04-0033-43,17-005,PETEN,SAN ANDRES,EORM,CASERIO LA PAZ,32852965,RICARDO ANTONIO GARCIA Y GARCIA,EDIN DE JESUS ALARCON ACOSTA,PRIMARIA,OFICIAL,RURAL,ABIERTA,MONOLINGUE,MATUTINA,DIARIO(REGULAR),PETÉN
17-04-0034-43,17-005,PETEN,SAN ANDRES,EORM,CASERIO LOS ALMENDROS,48099762,RICARDO ANTONIO GARCIA Y GARCIA,CLAUDIA PATRICIA PINELO TESUCÚN,PRIMARIA,OFICIAL,RURAL,ABIERTA,MONOLINGUE,MATUTINA,DIARIO(REGULAR),PETÉN
17-04-0035-43,17-002,PETEN,SAN ANDRES,EORM,CASERIO EL SIBALÓN LA PASADITA,,LILIA SAUDITA SUNTECUN CHAN,MIRNA PAULITA COLLÍ CHÍ,PRIMARIA,OFICIAL,RURAL,ABIERTA,MONOLINGUE,MATUTINA,DIARIO(REGULAR),PETÉN
17-04-0036-43,17-005,PETEN,SAN ANDRES,EORM,CASERIO SANTA MARTA,53323345,RICARDO ANTONIO GARCIA Y GARCIA,LUVIA LORENA GONZÁLEZ IPIÑA,PRIMARIA,OFICIAL,RURAL,ABIERTA,MONOLINGUE,MATUTINA,DIARIO(REGULAR),PETÉN
17-04-0037-43,17-002,PETEN,SAN ANDRES,EORM,BARRIO LA NUEVA ESPERANZA CASERIO CRUCE DOS AGUADAS,58489945,LILIA SAUDITA SUNTECUN CHAN,NINFA AYDEE ACOSTA TESUCÚN,PRIMARIA,OFICIAL,RURAL,ABIERTA,BILINGUE,MATUTINA,DIARIO(REGULAR),PETÉN
17-04-0038-43,17-004,PETEN,SAN ANDRES,EORM,CASERIO LA CEIBITA,46776422,CARLOS MANUEL TESUCUN QUETZAL,ELISA SARAHI GUERRA COLLI,PRIMARIA,OFICIAL,RURAL,ABIERTA,BILINGUE,MATUTINA,DIARIO(REGULAR),PETÉN
