0,1,2,3,4,5,6,7,8,9,10,11,12,13,14,15,16
CODIGO,DISTRITO,DEPARTAMENTO,MUNICIPIO,ESTABLECIMIENTO,DIRECCION,TELEFONO,SUPERVISOR,DIRECTOR,NIVEL,SECTOR,AREA,STATUS,MODALIDAD,JORNADA,PLAN,DEPARTAMENTAL
09-01-0125-45,09-005,QUETZALTENANGO,QUETZALTENANGO,"INSTITUTO NACIONAL ""JACOBO ARBENZ GUZMÁN""",4TA. CALLE 25-20 ZONA 3,41514439,JUAN CARLOS RONQUILLO DE LEON,JUAN CARLOS HERNÁNDEZ RÍOS,BASICO,OFICIAL,URBANA,ABIERTA,MONOLINGUE,NOCTURNA,DIARIO(REGULAR),QUETZALTENANGO
09-01-0126-45,09-005,QUETZALTENANGO,QUETZALTENANGO,"INEB ESCUELA NACIONAL DE CIENCIAS COMERCIALES DE OCCIDENTE SECCIÓN NOCTURNA ""ALBERTO CARDENAS RODAS""",5A CALLE 12-60 ZONA 3,77635504,JUAN CARLOS RONQUILLO DE LEON,MARÍA JOSEFINA MENDOZA ESCOBAR,BASICO,OFICIAL,URBANA,ABIERTA,MONOLINGUE,NOCTURNA,DIARIO(REGULAR),QUETZALTENANGO
09-01-0127-45,09-005,QUETZALTENANGO,QUETZALTENANGO,"INEEB ""GABRIEL ARRIOLA PORRES""",2A CALLE 14-51 ZONA 3,77612168,JUAN CARLOS RONQUILLO DE LEON,YENDI YOMARA SANTOS RODAS,BASICO,OFICIAL,URBANA,ABIERTA,MONOLINGUE,MATUTINA,DIARIO(REGULAR),QUETZALTENANGO
09-01-0128-45,09-005,QUETZALTENANGO,QUETZALTENANGO,INSTITUTO DE EDUCACION BASICA CON ORIENTACION INDUSTRIAL,0 CALLE 36 AVENIDA ZONA 8,77677742,JUAN CARLOS RONQUILLO DE LEON,LILIAN NOEMÍ BARRIOS BARRIOS,BASICO,OFICIAL,URBANA,ABIERTA,MONOLINGUE,MATUTINA,DIARIO(REGULAR),QUETZALTENANGO
09-01-0129-45,09-005,QUETZALTENANGO,QUETZALTENANGO,INSTITUTO NACIONAL EXPERIMENTAL DE EDUCACION BASICA DR. WERNER OVALLE LOPEZ,4A CALLE Y 25 AVE. ZONA 3,77674515,JUAN CARLOS RONQUILLO DE LEON,FREDY GAUDENCIO ALVARADO,BASICO,OFICIAL,URBANA,ABIERTA,MONOLINGUE,MATUTINA,DIARIO(REGULAR),QUETZALTENANGO
09-01-0130-45,09-005,QUETZALTENANGO,QUETZALTENANGO,INEB PARA SEÑORITAS,14 AVE. A-20 ZONA 1,77612658,JUAN CARLOS RONQUILLO DE LEON,JULIO CÉSAR SOLÍS ESCOBAR,BASICO,OFICIAL,URBANA,ABIERTA,MONOLINGUE,MATUTINA,DIARIO(REGULAR),QUETZALTENANGO
09-01-0131-45,09-005,QUETZALTENANGO,QUETZALTENANGO,INEB ADS. AL INSTITUTO NORMAL P/VARONES DE OCCIDENTE,CALLE RODOLFO ROBLES 12-20 ZONA 3,77616776,JUAN CARLOS RONQUILLO DE LEON,JUAN PABLO IXCOT XICARÁ,BASICO,OFICIAL,URBANA,ABIERTA,MONOLINGUE,MATUTINA,DIARIO(REGULAR),QUETZALTENANGO
09-01-0132-45,09-005,QUETZALTENANGO,QUETZALTENANGO,INEB ADS.AL INSTITUTO NORMAL PARA SEÑORITAS DE OCCIDENTE (I.N.S.O.),14 AVE. A 0-36 ZONA 1,77669946,JUAN CARLOS RONQUILLO DE LEON,ROSELIA HAYDÉE LÓPEZ MONZÓN,BASICO,OFICIAL,URBANA,ABIERTA,MONOLINGUE,MATUTINA,DIARIO(REGULAR),QUETZALTENANGO
09-01-0133-45,09-006,QUETZALTENANGO,QUETZALTENANGO,IPMB COLEGIO 'BETHEL',14 AVENIDA 0-69 ZONA 1,77631342,PEDRO GERÓNIMO SARAT CHAJ,EDGAR MAURICIO SIGÜENZA CALDERON,BASICO,PRIVADO,URBANA,ABIERTA,MONOLINGUE,VESPERTINA,DIARIO(REGULAR),QUETZALTENANGO
09-01-0134-45,09-002,QUETZALTENANGO,QUETZALTENANGO,IPMB 'AMERICANO',AVENIDA JESUS CASTILLO A -74 ZONA 1,77652176,ROSEMERY GUADALUPE PIEDRASANTA GRAMAJO DE SIGUENZA,LILIAM YOLANDA PEREYRA CASTILLO,BASICO,PRIVADO,URBANA,ABIERTA,MONOLINGUE,VESPERTINA,DIARIO(REGULAR),QUETZALTENANGO
09-01-0136-45,09-036,QUETZALTENANGO,QUETZALTENANGO,C0LEGIO MIXTO TERESA MARTIN,9A CALLE 10-09 ZONA 1,36479650,OBDULIO ROLANDO RUIZ ALVA,MARILIN ELIZABETH GARCÍA LOCÓN,BASICO,PRIVADO,URBANA,ABIERTA,MONOLINGUE,MATUTINA,DIARIO(REGULAR),QUETZALTENANGO
09-01-0137-45,09-006,QUETZALTENANGO,QUETZALTENANGO,IPMB COLEGIO 'BETHANIA',CALLE C 0-22 ZONA 1,77630164,PEDRO GERÓNIMO SARAT CHAJ,FERNANDO DAVID RIVERA ESPAÑA,BASICO,PRIVADO,URBANA,ABIERTA,MONOLINGUE,MATUTINA,DIARIO(REGULAR),QUETZALTENANGO
09-01-0139-45,09-006,QUETZALTENANGO,QUETZALTENANGO,INSTITUTO DE ESTUDIOS AVANZADOS DE OCCIDENTE,AV JESUS CASTILLO 1-81 ZONA 3,77611270,PEDRO GERÓNIMO SARAT CHAJ,MARÍA VALENTINA ANLEU DÍAZ,BASICO,PRIVADO,URBANA,ABIERTA,MONOLINGUE,MATUTINA,DIARIO(REGULAR),QUETZALTENANGO
09-01-0140-45,09-041,QUETZALTENANGO,QUETZALTENANGO,COLEGIO PARA SEÑORITAS ENCARNACION ROSAL,12 AVE. 3-09 ZONA 1,77258985,WILSON RANFERI SIGUENZA LOPEZ,SARA JULIETA LÓPEZ MARTINEZ,BASICO,PRIVADO,URBANA,ABIERTA,MONOLINGUE,MATUTINA,DIARIO(REGULAR),QUETZALTENANGO
09-01-0141-45,09-002,QUETZALTENANGO,QUETZALTENANGO,"COLEGIO PRIVADO MIXTO ""SUIZO QUETZALTENANGO""",1RA CALLE 43-50 ZONA 8,77635523,ROSEMERY GUADALUPE PIEDRASANTA GRAMAJO DE SIGUENZA,MIRNA LETICIA CIFUENTES GODINEZ,BASICO,PRIVADO,URBANA,ABIERTA,MONOLINGUE,MATUTINA,DIARIO(REGULAR),QUETZALTENANGO
09-01-0144-45,09-036,QUETZALTENANGO,QUETZALTENANGO,"COLEGIO ""MARIA AUXILIADORA""",3A CALLE 16-17 ZONA 3,77630281,OBDULIO ROLANDO RUIZ ALVA,YULISSA ANABELY OCHOA CIFUENTES,BASICO,PRIVADO,URBANA,ABIERTA,MONOLINGUE,MATUTINA,DIARIO(REGULAR),QUETZALTENANGO
09-01-0145-45,09-041,QUETZALTENANGO,QUETZALTENANGO,COLEGIO EVANGELICO LA PATRIA,19 AVENIDA 1-28 ZONA 3,77742400,WILSON RANFERI SIGUENZA LOPEZ,ERICK ESTUARDO COBAQUIL LARA,BASICO,PRIVADO,URBANA,ABIERTA,MONOLINGUE,MATUTINA,DIARIO(REGULAR),QUETZALTENANGO
09-01-0147-45,09-002,QUETZALTENANGO,QUETZALTENANGO,INSTITUTO TECNOLÓGICO PRIVADO DE OCCIDENTE,2A. CALLE A 5-13 ZONA 9,77671956,ROSEMERY GUADALUPE PIEDRASANTA GRAMAJO DE SIGUENZA,ALVARO GUILLERMO ARELLANO RODAS,BASICO,PRIVADO,URBANA,ABIERTA,MONOLINGUE,MATUTINA,DIARIO(REGULAR),QUETZALTENANGO
09-01-0148-45,09-036,QUETZALTENANGO,QUETZALTENANGO,INSTITUTO EXPERIMENTAL HUMANIDADES,1A CALLE 13-09 ZONA 1,77651466,OBDULIO ROLANDO RUIZ ALVA,LIGIA GUADALUPE RÍMOLA DIAZ,BASICO,PRIVADO,URBANA,ABIERTA,MONOLINGUE,VESPERTINA,DIARIO(REGULAR),QUETZALTENANGO
09-01-0150-45,09-041,QUETZALTENANGO,QUETZALTENANGO,"COLEGIO PRIVADO MIXTO ""SAN AGUSTÍN""",14 AVENIDA 0-69 ZONA 1,79268169,WILSON RANFERI SIGUENZA LOPEZ,GERARDO DE JESÚS ARGUETA ESTRADA,BASICO,PRIVADO,URBANA,ABIERTA,MONOLINGUE,DOBLE,FIN DE SEMANA,QUETZALTENANGO
09-01-0153-45,09-006,QUETZALTENANGO,QUETZALTENANGO,INSTITUTO EVANGELICO DE OCCIDENTE,4A CALLE 25-92 ZONA 1,77654062,PEDRO GERÓNIMO SARAT CHAJ,YENSY ROBERTO DÍAZ SOLÍS,BASICO,PRIVADO,URBANA,ABIERTA,MONOLINGUE,VESPERTINA,DIARIO(REGULAR),QUETZALTENANGO
09-01-0166-45,09-036,QUETZALTENANGO,QUETZALTENANGO,"COLEGIO ""EL PILAR""",0 CALLE 42-15 ZONA 9,77675220,OBDULIO ROLANDO RUIZ ALVA,EDNA VICTORIA ROMERO CACACHO,BASICO,PRIVADO,URBANA,ABIERTA,MONOLINGUE,MATUTINA,DIARIO(REGULAR),QUETZALTENANGO
09-01-0188-45,09-005,QUETZALTENANGO,QUETZALTENANGO,INSTITUTO MIXTO DE EDUCACION BASICA POR COOPERATIVA DE ENSEÑANZA MINERVA,"LAS TRES CRUCES, CANTÓN CHITUX",51731849,JUAN CARLOS RONQUILLO DE LEON,DANNY CRISTIAN GARCÍA ESCOBAR,BASICO,COOPERATIVA,URBANA,ABIERTA,MONOLINGUE,VESPERTINA,DIARIO(REGULAR),QUETZALTENANGO
09-01-0189-45,09-005,QUETZALTENANGO,QUETZALTENANGO,INSTITUTO MIXTO DE EDUCACION BASICA POR COOPERATIVA DE ENSEÑANZA EL PEDREGAL,"LAS INSTALACIONES DE LA EOUM ""SAN BARTOLOME"" 3RA. AVENIDA 0-49 ZONA 4",55575008,JUAN CARLOS RONQUILLO DE LEON,CARLOS HUMBERTO XILOJ CHIM,BASICO,COOPERATIVA,URBANA,ABIERTA,MONOLINGUE,VESPERTINA,DIARIO(REGULAR),QUETZALTENANGO
09-01-0190-45,09-005,QUETZALTENANGO,QUETZALTENANGO,INEB,"COLONIA DR. ROBERTO MOLINA, ZONA 5",47454734,JUAN CARLOS RONQUILLO DE LEON,GIOVANNI GUADALUPE GARCÍA COLOP,BASICO,OFICIAL,URBANA,ABIERTA,MONOLINGUE,VESPERTINA,DIARIO(REGULAR),QUETZALTENANGO
09-01-0191-45,09-005,QUETZALTENANGO,QUETZALTENANGO,INEB,COLONIA EL MAESTRO,42156187,JUAN CARLOS RONQUILLO DE LEON,KARIN MILAGRO MORALES MORALES,BASICO,OFICIAL,URBANA,ABIERTA,MONOLINGUE,VESPERTINA,DIARIO(REGULAR),QUETZALTENANGO
09-01-0192-45,09-005,QUETZALTENANGO,QUETZALTENANGO,INEB,COLONIA SAN ANTONIO,,JUAN CARLOS RONQUILLO DE LEON,MELVA ERLY BARRIOS DELGADO,BASICO,OFICIAL,URBANA,ABIERTA,MONOLINGUE,VESPERTINA,DIARIO(REGULAR),QUETZALTENANGO
09-01-0193-45,09-005,QUETZALTENANGO,QUETZALTENANGO,INEB JACOBO ARBENZ GUZMAN,"4A. CALLE 25-20, ZONA 3",37732794,JUAN CARLOS RONQUILLO DE LEON,EDGAR SAMUEL GARCÍA RAMÍREZ,BASICO,OFICIAL,URBANA,ABIERTA,MONOLINGUE,VESPERTINA,DIARIO(REGULAR),QUETZALTENANGO
09-01-0194-45,09-005,QUETZALTENANGO,QUETZALTENANGO,INEB,"18 AVE. 10A. CALLE ZONA 1, BARRIO LAS FLORES",59081247,JUAN CARLOS RONQUILLO DE LEON,GREYS BEATRIZ RODAS MAZARIEGOS,BASICO,OFICIAL,URBANA,ABIERTA,MONOLINGUE,VESPERTINA,DIARIO(REGULAR),QUETZALTENANGO
09-01-0200-45,09-005,QUETZALTENANGO,QUETZALTENANGO,INEB DE TELESECUNDARIA,CANTON CHUICAVIOC SECTOR 3,33939083,JUAN CARLOS RONQUILLO DE LEON,SILVIA FLOR ESCOBAR REYES,BASICO,OFICIAL,RURAL,ABIERTA,MONOLINGUE,VESPERTINA,DIARIO(REGULAR),QUETZALTENANGO
09-01-0201-45,09-005,QUETZALTENANGO,QUETZALTENANGO,INEB DE TELESECUNDARIA,6 AVENIDA 27-60 ZONA 5,59827123,JUAN CARLOS RONQUILLO DE LEON,LEONARDO DE JESÚS TARACENA SOSA,BASICO,OFICIAL,RURAL,ABIERTA,MONOLINGUE,VESPERTINA,DIARIO(REGULAR),QUETZALTENANGO
09-01-0202-45,09-005,QUETZALTENANGO,QUETZALTENANGO,INEB DE TELESECUNDARIA,14 CALLE D11B-91 ZONA 1,42889079,JUAN CARLOS RONQUILLO DE LEON,ESTELA ANTONIETA CUYUCH COROY,BASICO,OFICIAL,RURAL,ABIERTA,MONOLINGUE,VESPERTINA,DIARIO(REGULAR),QUETZALTENANGO
09-01-0204-45,09-005,QUETZALTENANGO,QUETZALTENANGO,INEB EL ADELANTO,1A. CALLE 12-25 ZONA 3,42896520,JUAN CARLOS RONQUILLO DE LEON,ANA LUISA HERRERA VELÁSQUEZ,BASICO,OFICIAL,URBANA,ABIERTA,MONOLINGUE,NOCTURNA,DIARIO(REGULAR),QUETZALTENANGO
09-01-0205-45,09-005,QUETZALTENANGO,QUETZALTENANGO,INEB DE TELESECUNDARIA,CANTON LLANOS DE LA CRUZ,45649271,JUAN CARLOS RONQUILLO DE LEON,NUVIA DIANET MÉRIDA GONZALEZ,BASICO,OFICIAL,RURAL,ABIERTA,MONOLINGUE,VESPERTINA,DIARIO(REGULAR),QUETZALTENANGO
09-01-0210-45,09-036,QUETZALTENANGO,QUETZALTENANGO,"COLEGIO ""BELLOS HORIZONTES LAS ROSAS""",7A. AVENIDA D 15-40 ZONA 5,79268564,OBDULIO ROLANDO RUIZ ALVA,FERMINA ARACELY OLA SAPÓN,BASICO,PRIVADO,URBANA,ABIERTA,MONOLINGUE,VESPERTINA,DIARIO(REGULAR),QUETZALTENANGO
09-01-0212-45,09-005,QUETZALTENANGO,QUETZALTENANGO,INEB,DIAGONAL 2 BARRIO GARIBALDI ZONA 3,47548459,JUAN CARLOS RONQUILLO DE LEON,JOSÉ ADOLFO MORALES BOJ,BASICO,OFICIAL,RURAL,ABIERTA,MONOLINGUE,VESPERTINA,DIARIO(REGULAR),QUETZALTENANGO
09-01-0217-45,09-006,QUETZALTENANGO,QUETZALTENANGO,COLEGIO PRIVADO MIXTO LICEO SAN LUIS,20 AVENIDA 1-16 ZONA 1,77612031,PEDRO GERÓNIMO SARAT CHAJ,JUAN BENJAMIN ANCHETA RODRIGUEZ,BASICO,PRIVADO,URBANA,ABIERTA,MONOLINGUE,VESPERTINA,DIARIO(REGULAR),QUETZALTENANGO
09-01-0222-45,09-041,QUETZALTENANGO,QUETZALTENANGO,COLEGIO ALBERT EINSTEIN,15 AVENIDA 0-42 ZONA 1,77683352,WILSON RANFERI SIGUENZA LOPEZ,AMILCAR LEONEL AGUILAR RIVERA,BASICO,PRIVADO,URBANA,ABIERTA,MONOLINGUE,MATUTINA,DIARIO(REGULAR),QUETZALTENANGO
09-01-0223-45,09-041,QUETZALTENANGO,QUETZALTENANGO,COLEGIO ALBERT EINSTEIN,15 AVENIDA 0-42 ZONA 1,77683352,WILSON RANFERI SIGUENZA LOPEZ,AMILCAR LEONEL AGUILAR RIVERA,BASICO,PRIVADO,URBANA,ABIERTA,MONOLINGUE,DOBLE,FIN DE SEMANA,QUETZALTENANGO
09-01-0233-45,09-002,QUETZALTENANGO,QUETZALTENANGO,INSTITUTO IBEROAMERICANO DE ESTUDIOS AVANZADOS,AVENIDA EL CENIZAL 0-79 ZONA 4,42570540,ROSEMERY GUADALUPE PIEDRASANTA GRAMAJO DE SIGUENZA,MIGUEL ANGEL PISQUIY QUIXTÁN,BASICO,PRIVADO,URBANA,ABIERTA,MONOLINGUE,DOBLE,FIN DE SEMANA,QUETZALTENANGO
09-01-0235-45,09-002,QUETZALTENANGO,QUETZALTENANGO,INSTITUTO IBEROAMERICANO DE ESTUDIOS AVANZADOS,AVENIDA EL CENIZAL 0-79 ZONA 4,77618088,ROSEMERY GUADALUPE PIEDRASANTA GRAMAJO DE SIGUENZA,MIGUEL ANGEL PISQUIY QUIXTÁN,BASICO,PRIVADO,URBANA,ABIERTA,MONOLINGUE,DOBLE,FIN DE SEMANA,QUETZALTENANGO
09-01-0249-45,09-041,QUETZALTENANGO,QUETZALTENANGO,COLEGIO ECO SCHOOL Q´ANILL,"CANTON CHICHIGUITAN SECTOR 2, BUENA VISTA ZONA 5",79268245,WILSON RANFERI SIGUENZA LOPEZ,EDNA PATRICIA GONZÁLEZ JUÁREZ,BASICO,PRIVADO,URBANA,ABIERTA,MONOLINGUE,MATUTINA,DIARIO(REGULAR),QUETZALTENANGO
09-01-0258-45,09-041,QUETZALTENANGO,QUETZALTENANGO,CENTRO DE ALTO NIVEL EDUCATIVO MAHANAIM (CANEM),2DA. CALLE 33-103 ZONA 8,38762811,WILSON RANFERI SIGUENZA LOPEZ,MIRIAM GEORGINA OVALLE LÓPEZ,BASICO,PRIVADO,URBANA,ABIERTA,MONOLINGUE,MATUTINA,DIARIO(REGULAR),QUETZALTENANGO
09-01-0263-45,09-041,QUETZALTENANGO,QUETZALTENANGO,ESCUELA PRIVADA MIXTO EVANGELICA SHEKINA,12 CALLE 1-90 ZONA 8,77673722,WILSON RANFERI SIGUENZA LOPEZ,LUDWING IVAN TEBALAN OROXOM,BASICO,PRIVADO,URBANA,ABIERTA,MONOLINGUE,MATUTINA,DIARIO(REGULAR),QUETZALTENANGO
09-01-0282-45,09-041,QUETZALTENANGO,QUETZALTENANGO,COLEGIO DE INVESTIGACION CIENTIFICA INTEGRAL -CICI-,2DA. CALLE 2-06 ZONA 7,77682442,WILSON RANFERI SIGUENZA LOPEZ,JOSÉ FLORENCIO SAPÓN TAX,BASICO,PRIVADO,URBANA,ABIERTA,MONOLINGUE,VESPERTINA,DIARIO(REGULAR),QUETZALTENANGO
09-01-0284-45,09-005,QUETZALTENANGO,QUETZALTENANGO,COLEGIO JOHN HARVARD,4TA. CALLE 16-33 ZONA 1,53438116,JUAN CARLOS RONQUILLO DE LEON,DANCI SUCELY CHÁVEZ GUZMÁN,BASICO,PRIVADO,URBANA,ABIERTA,MONOLINGUE,MATUTINA,DIARIO(REGULAR),QUETZALTENANGO
09-01-0289-45,09-041,QUETZALTENANGO,QUETZALTENANGO,COLEGIO MIXTO EL FARO,2A. AVENIDA 4-57 ZONA 10,77655462,WILSON RANFERI SIGUENZA LOPEZ,AROLDO DANILO CALDERON CALDERON,BASICO,PRIVADO,URBANA,ABIERTA,MONOLINGUE,VESPERTINA,DIARIO(REGULAR),QUETZALTENANGO
09-01-0298-45,09-036,QUETZALTENANGO,QUETZALTENANGO,COLEGIO EVANGELICO COMUNION,19 AVENIDA 0-32 ZONA 1,77618984,OBDULIO ROLANDO RUIZ ALVA,MONICA JOSÉ MORALES REZZIO,BASICO,PRIVADO,URBANA,ABIERTA,MONOLINGUE,MATUTINA,DIARIO(REGULAR),QUETZALTENANGO
09-01-0300-45,09-005,QUETZALTENANGO,QUETZALTENANGO,INSTITUTO MIXTO DE EDUCACION BASICA POR COOPERATIVA DE ENSEÑANZA TIERRA COLORADA,TIERRA COLORADA BAJA,51731937,JUAN CARLOS RONQUILLO DE LEON,JULIA ISABEL MACARIO SARAT,BASICO,COOPERATIVA,RURAL,ABIERTA,MONOLINGUE,VESPERTINA,DIARIO(REGULAR),QUETZALTENANGO
09-01-0306-45,09-036,QUETZALTENANGO,QUETZALTENANGO,CENTRO EDUCATIVO NUEVA CANCION -CENC-,8TA. CALLE 17-71 ZONA 3,77651390,OBDULIO ROLANDO RUIZ ALVA,SOFÍA DEL ROSARIO ALVAREZ GONZÁLEZ,BASICO,PRIVADO,URBANA,ABIERTA,MONOLINGUE,MATUTINA,DIARIO(REGULAR),QUETZALTENANGO
09-01-0308-45,09-041,QUETZALTENANGO,QUETZALTENANGO,COLEGIO INTERNACIONAL RACKSSON,29 AVENIDA 6TA. CALLE B26-28 ZONA 7,53938625,WILSON RANFERI SIGUENZA LOPEZ,KARLA MARIA LOPEZ QUEME,BASICO,PRIVADO,URBANA,ABIERTA,MONOLINGUE,MATUTINA,DIARIO(REGULAR),QUETZALTENANGO
09-01-0310-45,09-041,QUETZALTENANGO,QUETZALTENANGO,"COLEGIO PRIVADO MIXTO ""GANDHI""","DIAGONAL 3 36-89, ZONA 8",56707605,WILSON RANFERI SIGUENZA LOPEZ,JUAN LUIS LÓPEZ MARIN,BASICO,PRIVADO,URBANA,ABIERTA,MONOLINGUE,NOCTURNA,DIARIO(REGULAR),QUETZALTENANGO
09-01-0316-45,09-002,QUETZALTENANGO,QUETZALTENANGO,COLEGIO AMERICANO DE OCCIDENTE (WEST AMERICAN SCHOOL),"9A CALLE 24-35 ZONA 3,",30797058,ROSEMERY GUADALUPE PIEDRASANTA GRAMAJO DE SIGUENZA,CARLOS PETER FUENTES CHAVEZ,BASICO,PRIVADO,URBANA,ABIERTA,MONOLINGUE,MATUTINA,DIARIO(REGULAR),QUETZALTENANGO
09-01-0319-45,09-006,QUETZALTENANGO,QUETZALTENANGO,INSTITUTO GUATEMALTECO AMERICANO IGA,14 AVENIDA A 8-74 ZONA 3,77670955,PEDRO GERÓNIMO SARAT CHAJ,ANGELICA MARÍA JACOBS,BASICO,PRIVADO,URBANA,ABIERTA,MONOLINGUE,MATUTINA,DIARIO(REGULAR),QUETZALTENANGO
09-01-0320-45,09-006,QUETZALTENANGO,QUETZALTENANGO,COLEGIO BILINGÜE PASCAL,7A. AVENIDA 10-13 ZONA 5,77614073,PEDRO GERÓNIMO SARAT CHAJ,DEISY IRASEMA LÓPEZ ALECIO,BASICO,PRIVADO,URBANA,ABIERTA,MONOLINGUE,VESPERTINA,DIARIO(REGULAR),QUETZALTENANGO
09-01-0327-45,09-036,QUETZALTENANGO,QUETZALTENANGO,COLEGIO BYS (BEEHIVE FOR YOUNG STUDENTS),15 CALLE 1A-25 ZONA 6 LLANOS DE LA CRUZ,77639649,OBDULIO ROLANDO RUIZ ALVA,AMANDA PATRICIA SOSA GALINDO,BASICO,PRIVADO,URBANA,ABIERTA,MONOLINGUE,MATUTINA,DIARIO(REGULAR),QUETZALTENANGO
09-01-0329-45,09-036,QUETZALTENANGO,QUETZALTENANGO,COLEGIO SAGRADA FAMILIA,"4A CALLE 23A-24 ZONA 1,",58320034,OBDULIO ROLANDO RUIZ ALVA,JORGE LUIS DÍAZ DE LEÓN,BASICO,PRIVADO,URBANA,ABIERTA,MONOLINGUE,MATUTINA,DIARIO(REGULAR),QUETZALTENANGO
09-01-0338-45,09-002,QUETZALTENANGO,QUETZALTENANGO,CENTRO EDUCATIVO ASA (AFTER SCHOOL ACADEMY),"DIAGONAL 12 D11-72 ZONA 1, QUETZALTENANGO",77652766,ROSEMERY GUADALUPE PIEDRASANTA GRAMAJO DE SIGUENZA,CLAUDIA SUSANA LÓPEZ MURALLES,BASICO,PRIVADO,URBANA,ABIERTA,MONOLINGUE,MATUTINA,DIARIO(REGULAR),QUETZALTENANGO
09-01-0340-45,09-036,QUETZALTENANGO,QUETZALTENANGO,CENTRO EDUCATIVO PRIVADO DIVINA MISERICORDIA,"28 AVENIDA 9-54 INTERIOR ZONA 1, QUETZALTENANGO",42677376,OBDULIO ROLANDO RUIZ ALVA,MARIO RENE BARRIOS TELLO,BASICO,PRIVADO,URBANA,ABIERTA,MONOLINGUE,MATUTINA,DIARIO(REGULAR),QUETZALTENANGO
09-01-0343-45,09-036,QUETZALTENANGO,QUETZALTENANGO,"COLEGIO CRISTIANO BILINGÜE DE EDUCACIÓN ""CREATIVA""","3A. CALLE 6-51 SEGUNDO NIVEL, ZONA 2",77655924,OBDULIO ROLANDO RUIZ ALVA,EDGAR SAMUEL GARCÍA RAMÍREZ,BASICO,PRIVADO,URBANA,ABIERTA,MONOLINGUE,MATUTINA,DIARIO(REGULAR),QUETZALTENANGO
09-01-0353-45,09-036,QUETZALTENANGO,QUETZALTENANGO,COLEGIO TÉCNICO EMPRESARIAL INTEGRAL SUPERIOR DE LOS ALTOS -CTEISA-,"CANTÓN XECARACOJ, TIERRA COLORADA BAJA",77619224,OBDULIO ROLANDO RUIZ ALVA,HELEN MARLENY LÓPEZ ESTRADA,BASICO,PRIVADO,RURAL,ABIERTA,MONOLINGUE,MATUTINA,DIARIO(REGULAR),QUETZALTENANGO
09-01-0357-45,09-041,QUETZALTENANGO,QUETZALTENANGO,COLEGIO ALTO DESEMPEÑO ACADEMICO LIBERTADOR,"DIAGONAL 11 D 12-03 ZONA 1, BARRIO LAS FLORES",56332397,WILSON RANFERI SIGUENZA LOPEZ,MÍRIAM VERÓNICA ESCOBAR ARRIOLA,BASICO,PRIVADO,URBANA,ABIERTA,MONOLINGUE,VESPERTINA,DIARIO(REGULAR),QUETZALTENANGO
09-01-0361-45,09-036,QUETZALTENANGO,QUETZALTENANGO,"CORPORACIÓN EDUCATIVA INTERNACIONAL ""PLUS-ULTRA""","29 AVENIDA 1-22 ZONA 7, COLONIA PRADOS DE SANTA MARÍA",77635172,OBDULIO ROLANDO RUIZ ALVA,DELMA FLORIDALMA MUNGUIA POLANCO,BASICO,PRIVADO,URBANA,ABIERTA,MONOLINGUE,VESPERTINA,DIARIO(REGULAR),QUETZALTENANGO
09-01-0365-45,09-006,QUETZALTENANGO,QUETZALTENANGO,COLEGIO HOLANDÉS,1RA. CALLE 42-44 ZONA 8,77637804,PEDRO GERÓNIMO SARAT CHAJ,EDGAR SAMUEL GARCÍA RAMÍREZ,BASICO,PRIVADO,URBANA,ABIERTA,MONOLINGUE,MATUTINA,DIARIO(REGULAR),QUETZALTENANGO
09-01-0367-45,09-005,QUETZALTENANGO,QUETZALTENANGO,INEB,"5TA. CALLE 12-60-ZONA 3,",38110889,JUAN CARLOS RONQUILLO DE LEON,SURAMA AMPARO GRANADOS DE LEÓN,BASICO,OFICIAL,URBANA,ABIERTA,MONOLINGUE,MATUTINA,DIARIO(REGULAR),QUETZALTENANGO
09-01-0368-45,09-041,QUETZALTENANGO,QUETZALTENANGO,"COLEGIO CRISTIANO MIXTO BILINGÜE ""EL OLIMPO""",1A. AVENIDA 0-45 ZONA 9,42918044,WILSON RANFERI SIGUENZA LOPEZ,EDIN ISRAEL IXQUIAC CANIZ,BASICO,PRIVADO,URBANA,ABIERTA,MONOLINGUE,VESPERTINA,DIARIO(REGULAR),QUETZALTENANGO
09-01-0376-45,09-036,QUETZALTENANGO,QUETZALTENANGO,COLEGIO DE FORMACIÓN INTEGRAL BILINGÜE VILLA EDUCATIVA,22 AVENIDA 10-24 ZOZNA 3,77610607,OBDULIO ROLANDO RUIZ ALVA,CELIA ISABEL HOFFENS BARTLETT,BASICO,PRIVADO,URBANA,ABIERTA,MONOLINGUE,MATUTINA,DIARIO(REGULAR),QUETZALTENANGO
09-01-0381-45,09-006,QUETZALTENANGO,QUETZALTENANGO,INSTITUTO EVANGÉLICO DE OCCIDENTE,4TA. CALLE 25-92- ZONA 1,77654062,PEDRO GERÓNIMO SARAT CHAJ,YENSY ROBERTO DÍAZ SOLÍS,BASICO,PRIVADO,URBANA,ABIERTA,MONOLINGUE,MATUTINA,DIARIO(REGULAR),QUETZALTENANGO
09-01-0409-45,09-036,QUETZALTENANGO,QUETZALTENANGO,LITTLE ANGELS BASIC SCHOOL,8A. AVENIDA 0-16 ZONA 3,77612871,OBDULIO ROLANDO RUIZ ALVA,MARÍA DEL CARMEN FRANCO URÍZAR,BASICO,PRIVADO,URBANA,ABIERTA,MONOLINGUE,MATUTINA,DIARIO(REGULAR),QUETZALTENANGO
09-01-0410-45,09-012,QUETZALTENANGO,QUETZALTENANGO,CENTRO DE EDUCACIÓN EXTRAESCOLAR CEEX-CEIPA,7A. CALLE 19-52 ZONA 3,77673695,JUAN JOSE COLOP COLOP,GERONIMO DAVID MACARIO CHAJ,BASICO,PRIVADO,URBANA,ABIERTA,MONOLINGUE,DOBLE,FIN DE SEMANA,QUETZALTENANGO
09-01-0411-45,09-036,QUETZALTENANGO,QUETZALTENANGO,COLEGIO MIXTO LICEO METROPOLITANO,6TA. AVENIDA 8-43 ZONA 1,77651508,OBDULIO ROLANDO RUIZ ALVA,ALMA JANETH CHACLÁN COYOY,BASICO,PRIVADO,URBANA,ABIERTA,MONOLINGUE,DOBLE,FIN DE SEMANA,QUETZALTENANGO
09-01-0413-45,09-001,QUETZALTENANGO,QUETZALTENANGO,CENTRO EDUCATIVO PRIVADO COLEGIO PREUNIVERSITARIO SALAMANCA,4A. CALLE 16-33 ZONA 1,77613279,IRIS ONDINA HERNANDEZ ROJAS DE SOTO,CLAUDIA MARLENI ELÍAS COJULUN DE CIFUENTES,BASICO,PRIVADO,URBANA,ABIERTA,MONOLINGUE,NOCTURNA,DIARIO(REGULAR),QUETZALTENANGO
09-01-0418-45,09-041,QUETZALTENANGO,QUETZALTENANGO,"COLEGIO PRIVADO MIXTO ""SAN AGUSTÍN""",14 AVENIDA 0-69 ZONA 1,79268169,WILSON RANFERI SIGUENZA LOPEZ,GERARDO DE JESÚS ARGUETA ESTRADA,BASICO,PRIVADO,URBANA,ABIERTA,MONOLINGUE,DOBLE,FIN DE SEMANA,QUETZALTENANGO
09-01-0424-45,09-036,QUETZALTENANGO,QUETZALTENANGO,COLEGIO MIXTO LICEO METROPOLITANO,6TA. AVENIDA 8-43 ZONA 1,77651433,OBDULIO ROLANDO RUIZ ALVA,ALMA JANETH CHACLÁN COYOY,BASICO,PRIVADO,URBANA,ABIERTA,MONOLINGUE,VESPERTINA,DIARIO(REGULAR),QUETZALTENANGO
09-01-0426-45,09-041,QUETZALTENANGO,QUETZALTENANGO,ZETH CENTRO EDUCATIVO,9A. CALLE 4-80 ZONA 9,30814838,WILSON RANFERI SIGUENZA LOPEZ,MAGDA JEANNETTE SANTISTEBAN FLORES,BASICO,PRIVADO,URBANA,ABIERTA,MONOLINGUE,MATUTINA,DIARIO(REGULAR),QUETZALTENANGO
09-01-0428-45,09-005,QUETZALTENANGO,QUETZALTENANGO,"CENTRO EDUCATIVO PRIVADO COLEGIO PREUNIVERSITARIO ""SALAMANCA""",9A. AVENIDA 0-36 ZONA 3,47652631,JUAN CARLOS RONQUILLO DE LEON,CLAUDIA MARLENI ELÍAS COJULUN,BASICO,PRIVADO,URBANA,ABIERTA,MONOLINGUE,MATUTINA,DIARIO(REGULAR),QUETZALTENANGO
09-01-0432-45,09-036,QUETZALTENANGO,QUETZALTENANGO,COLEGIO TÉCNICO EMPRESARIAL INTEGRAL SUPERIOR DE LOS ALTOS -CTEISA-,"SECTOR 5 CANTÓN XECARACOJ, TIERRA COLORADA BAJA",77619224,OBDULIO ROLANDO RUIZ ALVA,ELVIN EZEQUIAS ALONZO PÉREZ,BASICO,PRIVADO,RURAL,ABIERTA,MONOLINGUE,DOBLE,FIN DE SEMANA,QUETZALTENANGO
09-01-0433-45,09-036,QUETZALTENANGO,QUETZALTENANGO,COLEGIO TÉCNICO EMPRESARIAL INTEGRAL SUPERIOR DE LOS ALTOS -CTEISA-,"SECTOR 5 CANTÓN XECARACOJ, TIERRA COLORADA BAJA",77619224,OBDULIO ROLANDO RUIZ ALVA,ELVIN EZEQUIAS ALONZO PÉREZ,BASICO,PRIVADO,RURAL,ABIERTA,MONOLINGUE,DOBLE,A DISTANCIA,QUETZALTENANGO
09-01-0435-45,09-005,QUETZALTENANGO,QUETZALTENANGO,"CENTRO EDUCATIVO PRIVADO COLEGIO PREUNIVERSITARIO ""SALAMANCA""",9A. AVENIDA 0-36 ZONA 3,47652631,JUAN CARLOS RONQUILLO DE LEON,CLAUDIA MARLENI ELÍAS COJULUN,BASICO,PRIVADO,URBANA,ABIERTA,MONOLINGUE,DOBLE,FIN DE SEMANA,QUETZALTENANGO
09-01-0437-45,09-041,QUETZALTENANGO,QUETZALTENANGO,COLEGIO LA PAZ MONTESSORI,40 AVENIDA 1-90 ZONA 8,41004136,WILSON RANFERI SIGUENZA LOPEZ,LESLEY LARIZA BARILLAS MAZARIEGOS,BASICO,PRIVADO,URBANA,ABIERTA,MONOLINGUE,MATUTINA,DIARIO(REGULAR),QUETZALTENANGO
09-01-0440-45,09-008,QUETZALTENANGO,QUETZALTENANGO,"CENTRO EDUCATIVO TÉCNICO INCLUSIVO ""DRA. H. C. ELISA MOLINA DE STAHL""","DIAGONAL 15 7-25 ZONA 5, BARRIO LAS ROSAS",41647045,RAMON YAX LAINES,KANDY ALEJANDRA XICARÁ VELÁSQUEZ,BASICO,PRIVADO,URBANA,ABIERTA,MONOLINGUE,MATUTINA,DIARIO(REGULAR),QUETZALTENANGO
09-01-0441-45,09-012,QUETZALTENANGO,QUETZALTENANGO,CENTRO DE EDUCACIÓN EXTRAESCOLAR -CEEX QUETZALTENANGO,"0 AVENIDA 5-08, ZONA 6, EL MIRADOR",44988031,JUAN JOSE COLOP COLOP,CLAUDIA EDELMIRA AGUILAR LÓPEZ,BASICO,PRIVADO,URBANA,ABIERTA,MONOLINGUE,DOBLE,DIARIO(REGULAR),QUETZALTENANGO
09-01-0448-45,09-006,QUETZALTENANGO,QUETZALTENANGO,COLEGIO INTEGRAL PRINCIPIOS,32 AVENIDA D2-87 ZONA 3,77636740,PEDRO GERÓNIMO SARAT CHAJ,LIDIA YOLANDA PÉREZ REYNOSO,BASICO,PRIVADO,URBANA,ABIERTA,MONOLINGUE,MATUTINA,DIARIO(REGULAR),QUETZALTENANGO
09-01-0456-45,09-004,QUETZALTENANGO,QUETZALTENANGO,COLEGIO PROFESIONALES DEL FUTURO 2ND. HOME,"DIAGONAL 2, 32-48 ZONA 3, CONDOMINIO RESIDENCIALES LA VILLA",77670935,DINA RUBI GONZALEZ DE LEON,NANCY ROSEMARY HURTARTE CHAVARRIA DE CÓBAR,BASICO,PRIVADO,URBANA,ABIERTA,MONOLINGUE,MATUTINA,DIARIO(REGULAR),QUETZALTENANGO
09-01-0459-45,09-006,QUETZALTENANGO,QUETZALTENANGO,COLEGIO LICEO GUATEMALA DE QUETZALTENANGO,"14 AVENIDA ""A"" 8-74 ZONA 3",77675657,PEDRO GERÓNIMO SARAT CHAJ,SERGIO ALEXSANDER CASTELLANOS ROBLES,BASICO,PRIVADO,URBANA,ABIERTA,MONOLINGUE,MATUTINA,DIARIO(REGULAR),QUETZALTENANGO
09-01-0461-45,09-041,QUETZALTENANGO,QUETZALTENANGO,COLEGIO MIXTO EL FARO,2DA. AVENIDA 4-57 ZONA 10,77655462,WILSON RANFERI SIGUENZA LOPEZ,AROLDO DANILO CALDERON CALDERON,BASICO,PRIVADO,URBANA,ABIERTA,MONOLINGUE,MATUTINA,DIARIO(REGULAR),QUETZALTENANGO
09-01-0470-45,09-041,QUETZALTENANGO,QUETZALTENANGO,COLEGIO LIFE SCHOOL,11 CALLE 0-07 ZONA 2,42239494,WILSON RANFERI SIGUENZA LOPEZ,ANA LUCRECIA URRUTIA CANCINOS,BASICO,PRIVADO,URBANA,ABIERTA,MONOLINGUE,MATUTINA,DIARIO(REGULAR),QUETZALTENANGO
09-01-0471-45,09-002,QUETZALTENANGO,QUETZALTENANGO,LICEO ITALIANO TRILINGÜE,1A CALLE D15 29-04 ZONA 1,77677806,ROSEMERY GUADALUPE PIEDRASANTA GRAMAJO DE SIGUENZA,NUSY ERICA GONZÁLEZ VÁSQUEZ,BASICO,PRIVADO,URBANA,ABIERTA,MONOLINGUE,MATUTINA,DIARIO(REGULAR),QUETZALTENANGO
09-01-0475-45,09-006,QUETZALTENANGO,QUETZALTENANGO,"CENTRO EDUCATIVO ""ISEA QUETZALTENANGO""","21 AVENIDA 0-28, ZONA 3, EDIFICIO MINERVA, OFICINA 204",77654744,PEDRO GERÓNIMO SARAT CHAJ,LIGIA ELENA MORALES PALACIOS,BASICO,PRIVADO,URBANA,ABIERTA,MONOLINGUE,MATUTINA,A DISTANCIA,QUETZALTENANGO
09-01-0481-45,09-012,QUETZALTENANGO,QUETZALTENANGO,"""CENTRO DE EDUCACIÓN EXTRAESCOLAR CEEX-QUETZALTENANGO",2 CALLE 15A-43 ZONA 1,79621000,JUAN JOSE COLOP COLOP,JOSÉ MARÍA COLOP COLOP,BASICO,OFICIAL,URBANA,ABIERTA,MONOLINGUE,SIN JORNADA,SEMIPRESENCIAL (UN DÍA A LA SEMANA),QUETZALTENANGO
09-01-0482-45,09-006,QUETZALTENANGO,QUETZALTENANGO,COLEGIO MIXTO PRIVADO SAN JOSÉ,20 AVENIDA 1-07 ZONA 1,77618584,PEDRO GERÓNIMO SARAT CHAJ,JHONATAN EDUARDO SAC CAYAX,BASICO,PRIVADO,URBANA,ABIERTA,MONOLINGUE,SIN JORNADA,SEMIPRESENCIAL (UN DÍA A LA SEMANA),QUETZALTENANGO
09-01-0486-45,09-006,QUETZALTENANGO,QUETZALTENANGO,COLEGIO MIXTO PRIVADO SAN JOSÉ,20 AVENIDA 1-07 ZONA 1,77618584,PEDRO GERÓNIMO SARAT CHAJ,JHONATAN EDUARDO SAC CAYAX,BASICO,PRIVADO,URBANA,ABIERTA,MONOLINGUE,MATUTINA,VIRTUAL A DISTANCIA,QUETZALTENANGO
09-01-0487-45,09-006,QUETZALTENANGO,QUETZALTENANGO,COLEGIO MIXTO PRIVADO SAN JOSÉ,20 AVENIDA 1-07 ZONA 1,77618584,PEDRO GERÓNIMO SARAT CHAJ,JHONATAN EDUARDO SAC CAYAX,BASICO,PRIVADO,URBANA,ABIERTA,MONOLINGUE,VESPERTINA,VIRTUAL A DISTANCIA,QUETZALTENANGO
09-01-0488-45,09-006,QUETZALTENANGO,QUETZALTENANGO,COLEGIO MIXTO PRIVADO SAN JOSÉ,20 AVENIDA 1-07 ZONA 1,77618584,PEDRO GERÓNIMO SARAT CHAJ,JHONATAN EDUARDO SAC CAYAX,BASICO,PRIVADO,URBANA,ABIERTA,MONOLINGUE,DOBLE,VIRTUAL A DISTANCIA,QUETZALTENANGO
09-01-0492-45,09-002,QUETZALTENANGO,QUETZALTENANGO,INSTITUTO TECNOLÓGICO PRIVADO DE OCCIDENTE,"2A. CALLE ""A"" 5-13 ZONA 9",77635145,ROSEMERY GUADALUPE PIEDRASANTA GRAMAJO DE SIGUENZA,ALVARO GUILLERMO ARELLANO RODAS,BASICO,PRIVADO,URBANA,ABIERTA,MONOLINGUE,SIN JORNADA,SEMIPRESENCIAL (UN DÍA A LA SEMANA),QUETZALTENANGO
